{"_id":{"$oid":"613524673eae5e001753db72"},"bill_id":"CH-1HcEbacNZ","user_name":"Daksh Singh","user_id":"qxRjICgll","customer_name":"nancy","employee_id":"IndhEzqMx","employee_name":"Abhinav Singh","customer_phone":null,"customer_alternative_phone":null,"customer_address":"","payment_mode":"Cash","branch_id":"gW0vfq11U","branch_name":"Dunlop Habibb","total_price":1023,"booking_amount":523,"service_amount":null,"date":"06-09-2021","createdOn":{"$date":"2021-09-05T20:11:19Z"},"products":[],"services":[{"service_name":"Haircut","service_id":"T8YR1GYLB","quantity":2,"_id":{"$oid":"613524673eae5e001753db73"}}],"__v":0}
{"_id":{"$oid":"613532cd3eae5e001753dce6"},"bill_id":"CH-nbuMJw2bk","user_name":"Daksh Singh","user_id":"qxRjICgll","customer_name":"RF","employee_id":"IndhEzqMx","employee_name":"Abhinav Singh","customer_phone":9.874891525E+09,"customer_alternative_phone":null,"customer_address":"","payment_mode":"Cash","branch_id":"gW0vfq11U","branch_name":"Dunlop Habibb","total_price":500,"booking_amount":0,"service_amount":null,"date":"06-09-2021","createdOn":{"$date":"2021-09-05T21:12:45Z"},"products":[{"product_name":"Conditioner","product_id":"owtoMcxtB","quantity":1,"_id":{"$oid":"613532cd3eae5e001753dce7"}}],"services":[{"service_name":"Haircut","service_id":"T8YR1GYLB","quantity":2,"_id":{"$oid":"613532cd3eae5e001753dce8"}}],"__v":0}
{"_id":{"$oid":"6135dfcab5335400175aaeb1"},"bill_id":"CH-LSdweNgq7","user_name":"Daksh Singh","user_id":"qxRjICgll","customer_name":"RS","employee_id":"IndhEzqMx","employee_name":"Abhinav Singh","customer_phone":9.874891525E+09,"customer_alternative_phone":null,"customer_address":"","payment_mode":"Net Banking","branch_id":"gW0vfq11U","branch_name":"Dunlop Habibb","total_price":500,"booking_amount":0,"service_amount":null,"date":"06-09-2021","createdOn":{"$date":"2021-09-06T09:30:50Z"},"products":[],"services":[{"service_name":"Haircut","service_id":"T8YR1GYLB","quantity":1,"_id":{"$oid":"6135dfcab5335400175aaeb2"}}],"__v":0}
{"_id":{"$oid":"6135e026b5335400175aaec4"},"bill_id":"CH-v5eSFBhlK","user_name":"Daksh Singh","user_id":"qxRjICgll","customer_name":"S","employee_id":"CV8PZ_N9j","employee_name":"Aarav Singh","customer_phone":null,"customer_alternative_phone":null,"customer_address":"","payment_mode":"Card","branch_id":"gW0vfq11U","branch_name":"Dunlop Habibb","total_price":250,"booking_amount":0,"service_amount":null,"date":"06-09-2021","createdOn":{"$date":"2021-09-06T09:32:22Z"},"products":[],"services":[{"service_name":"Haircut","service_id":"T8YR1GYLB","quantity":1,"_id":{"$oid":"6135e026b5335400175aaec5"}}],"__v":0}
{"_id":{"$oid":"6135e07fb5335400175aaed6"},"bill_id":"CH-LQFRyMTOP","user_name":"Daksh Singh","user_id":"qxRjICgll","customer_name":"","employee_id":"IndhEzqMx","employee_name":"Abhinav Singh","customer_phone":null,"customer_alternative_phone":null,"customer_address":"","payment_mode":"Cash","branch_id":"gW0vfq11U","branch_name":"Dunlop Habibb","total_price":300,"booking_amount":0,"service_amount":null,"date":"06-09-2021","createdOn":{"$date":"2021-09-06T09:33:51Z"},"products":[],"services":[{"service_name":"Haircut","service_id":"T8YR1GYLB","quantity":1,"_id":{"$oid":"6135e07fb5335400175aaed7"}}],"__v":0}
{"_id":{"$oid":"613db5282e1a0c0017e2cb14"},"bill_id":"CH-dq47SE8vH","user_name":"Daksh Singh","user_id":"qxRjICgll","customer_name":"","employee_id":"","employee_name":"","customer_phone":null,"customer_alternative_phone":null,"customer_address":"","payment_mode":"Cash","branch_id":"gW0vfq11U","branch_name":"Dunlop Habibb","total_price":9351,"booking_amount":0,"service_amount":null,"date":"12-09-2021","createdOn":{"$date":"2021-09-12T08:07:04Z"},"products":[{"product_name":"Conditioner","product_id":"owtoMcxtB","quantity":3,"employee_id":"IndhEzqMx","employee_name":"Abhinav Singh","total":8851,"_id":{"$oid":"613db5282e1a0c0017e2cb15"}}],"services":[{"service_name":"Haircut","service_id":"T8YR1GYLB","quantity":3,"employee_id":"CV8PZ_N9j","employee_name":"Aarav Singh","total":500,"_id":{"$oid":"613db5282e1a0c0017e2cb16"}}],"__v":0}
{"_id":{"$oid":"613e5c48ee19b00017d2b06f"},"bill_id":"CH-uT0Sq5ty0","user_name":"Daksh Singh","user_id":"qxRjICgll","customer_name":"Anish","employee_id":"","employee_name":"","customer_phone":7.890891405E+09,"customer_alternative_phone":null,"customer_address":"","payment_mode":"Cash","branch_id":"gW0vfq11U","branch_name":"Dunlop Habibb","total_price":806,"booking_amount":0,"service_amount":null,"date":"13-09-2021","createdOn":{"$date":"2021-09-12T20:00:08Z"},"products":[{"product_name":"Conditioner","product_id":"owtoMcxtB","quantity":1,"employee_id":"CV8PZ_N9j","employee_name":"Aarav Singh","total":254,"_id":{"$oid":"613e5c48ee19b00017d2b070"}}],"services":[{"service_name":"Haircut","service_id":"T8YR1GYLB","quantity":3,"employee_id":"CV8PZ_N9j","employee_name":"Aarav Singh","total":552,"_id":{"$oid":"613e5c48ee19b00017d2b071"}}],"__v":0}
{"_id":{"$oid":"613e77529c03dd0017ff0721"},"bill_id":"CH-GJ-lXCZe1","user_name":"Daksh Singh","user_id":"qxRjICgll","customer_name":"RDB","employee_id":"","employee_name":"","customer_phone":null,"customer_alternative_phone":null,"customer_address":"","payment_mode":"Card","branch_id":"gW0vfq11U","branch_name":"Dunlop Habibb","total_price":3000,"booking_amount":0,"service_amount":null,"date":"13-09-2021","createdOn":{"$date":"2021-09-12T21:55:30Z"},"products":[{"product_name":"Conditioner","product_id":"owtoMcxtB","quantity":2,"employee_id":"IndhEzqMx","employee_name":"Abhinav Singh","total":2000,"_id":{"$oid":"613e77529c03dd0017ff0722"}}],"services":[{"service_name":"Haircut","service_id":"T8YR1GYLB","quantity":2,"employee_id":"IndhEzqMx","employee_name":"Abhinav Singh","total":1000,"_id":{"$oid":"613e77529c03dd0017ff0723"}}],"__v":0}
{"_id":{"$oid":"6159a13a3c85d500179009fe"},"bill_id":"CH-GJ9vDC31x","user_name":"Daksh Singh","user_id":"qxRjICgll","customer_name":"Atreyi","employee_id":"","employee_name":"","customer_phone":null,"customer_alternative_phone":null,"customer_address":"","payment_mode":"Cash","branch_id":"item.branch_id","branch_name":"Dunlop Habibb","total_price":830,"booking_amount":1000,"service_amount":null,"date":"03-10-2021","createdOn":{"$date":"2021-10-03T12:25:30Z"},"products":[{"product_name":"Conditioner","product_id":"owtoMcxtB","quantity":1,"employee_id":"CV8PZ_N9j","employee_name":"Aarav Singh","total":600,"_id":{"$oid":"6159a13a3c85d500179009ff"}}],"services":[{"service_name":"Facial","service_id":"agtujlrlx","quantity":1,"employee_id":"X4rvp4rOl","employee_name":"Aniket Singh","total":500,"_id":{"$oid":"6159a13a3c85d50017900a00"}},{"service_name":"Facial","service_id":"agtujlrlx","quantity":1,"employee_id":"IndhEzqMx","employee_name":"Abhinav Singh","total":230,"_id":{"$oid":"6159a13a3c85d50017900a01"}},{"service_name":"Hiarcut","service_id":"_lgiV_EF6","quantity":1,"employee_id":"HSSbtC8oe","employee_name":"Abhishek Sharma","total":500,"_id":{"$oid":"6159a13a3c85d50017900a02"}}],"__v":0}
{"_id":{"$oid":"6159ab8e3c85d50017900a85"},"bill_id":"CH-ovXoZkR-K","user_name":"Daksh Singh","user_id":"qxRjICgll","customer_name":"atreyi","employee_id":"","employee_name":"","customer_phone":null,"customer_alternative_phone":null,"customer_address":"","payment_mode":"Cash","branch_id":"KOhOskJLG","branch_name":"Dunlop Habibb","total_price":750,"booking_amount":500,"service_amount":null,"date":"03-10-2021","createdOn":{"$date":"2021-10-03T13:09:34Z"},"products":[],"services":[{"service_name":"Facial","service_id":"agtujlrlx","quantity":1,"employee_id":"CV8PZ_N9j","employee_name":"Aarav Singh","total":500,"_id":{"$oid":"6159ab8e3c85d50017900a86"}},{"service_name":"Facial","service_id":"agtujlrlx","quantity":1,"employee_id":"X4rvp4rOl","employee_name":"Aniket Singh","total":300,"_id":{"$oid":"6159ab8e3c85d50017900a87"}},{"service_name":"Hiarcut","service_id":"_lgiV_EF6","quantity":1,"employee_id":"HSSbtC8oe","employee_name":"Abhishek Sharma","total":450,"_id":{"$oid":"6159ab8e3c85d50017900a88"}}],"__v":0}
{"_id":{"$oid":"615a0cc02748f70017c2558c"},"bill_id":"CH-NgDMczRQ5","user_name":"Daksh Singh","user_id":"qxRjICgll","customer_name":"Aarshu Sharma","customer_phone":null,"customer_alternative_phone":null,"customer_address":"","payment_mode":"Cash","branch_id":"KOhOskJLG","branch_name":"Dunlop Habibb","total_price":2265,"booking_amount":500,"amount_to_be_paid":1765,"service_amount":null,"date":"04-10-2021","createdOn":{"$date":"2021-10-03T20:04:16Z"},"products":[],"services":[{"service_name":"Facial","service_id":"agtujlrlx","quantity":1,"employee_id":"CV8PZ_N9j","employee_name":"Aarav Singh","total":500,"_id":{"$oid":"615a0cc02748f70017c2558d"}},{"service_name":"Facial","service_id":"agtujlrlx","quantity":1,"employee_id":"X4rvp4rOl","employee_name":"Aniket Singh","total":234,"_id":{"$oid":"615a0cc02748f70017c2558e"}},{"service_name":"Hiarcut","service_id":"_lgiV_EF6","quantity":1,"employee_id":"X4rvp4rOl","employee_name":"Aniket Singh","total":675,"_id":{"$oid":"615a0cc02748f70017c2558f"}},{"service_name":"Hiarcut","service_id":"_lgiV_EF6","quantity":1,"employee_id":"HSSbtC8oe","employee_name":"Abhishek Sharma","total":400,"_id":{"$oid":"615a0cc02748f70017c25590"}},{"service_name":"Hiarcut","service_id":"_lgiV_EF6","quantity":1,"employee_id":"IndhEzqMx","employee_name":"Abhinav Singh","total":456,"_id":{"$oid":"615a0cc02748f70017c25591"}}],"__v":0}
{"_id":{"$oid":"615b52e07cc68f0017465d59"},"bill_id":"CH-o9RUcDU2m","user_name":"Daksh Singh","user_id":"qxRjICgll","customer_name":"","customer_phone":null,"customer_alternative_phone":null,"customer_address":"","payment_mode":"Cash","branch_id":"KOhOskJLG","branch_name":"Dunlop Habibb","total_price":1400,"booking_amount":0,"amount_to_be_paid":1400,"service_amount":null,"date":"05-10-2021","createdOn":{"$date":"2021-10-04T19:15:44Z"},"products":[],"services":[{"service_name":"Facial","service_id":"agtujlrlx","quantity":1,"employee_id":"CV8PZ_N9j","employee_name":"Aarav Singh","total":200,"_id":{"$oid":"615b52e07cc68f0017465d5a"}},{"service_name":"Facial","service_id":"agtujlrlx","quantity":1,"employee_id":"X4rvp4rOl","employee_name":"Aniket Singh","total":300,"_id":{"$oid":"615b52e07cc68f0017465d5b"}},{"service_name":"Hiarcut","service_id":"_lgiV_EF6","quantity":1,"employee_id":"IndhEzqMx","employee_name":"Abhinav Singh","total":400,"_id":{"$oid":"615b52e07cc68f0017465d5c"}},{"service_name":"Hiarcut","service_id":"_lgiV_EF6","quantity":1,"employee_id":"HSSbtC8oe","employee_name":"Abhishek Sharma","total":500,"_id":{"$oid":"615b52e07cc68f0017465d5d"}}],"__v":0}
{"_id":{"$oid":"615b552e8d33490017c1e4a3"},"bill_id":"CH-QN22vYH1V","user_name":"Daksh Singh","user_id":"qxRjICgll","customer_name":"","customer_phone":null,"customer_alternative_phone":null,"customer_address":"","payment_mode":"Cash","branch_id":"KOhOskJLG","branch_name":"Dunlop Habibb","total_price":1623,"booking_amount":0,"amount_to_be_paid":1623,"service_amount":null,"date":"05-10-2021","createdOn":{"$date":"2021-10-04T19:25:34Z"},"products":[],"services":[{"service_name":"Facial","service_id":"agtujlrlx","quantity":1,"employee_id":"CV8PZ_N9j","employee_name":"Aarav Singh","total":400,"_id":{"$oid":"615b552e8d33490017c1e4a4"}},{"service_name":"Facial","service_id":"agtujlrlx","quantity":1,"employee_id":"X4rvp4rOl","employee_name":"Aniket Singh","total":503,"_id":{"$oid":"615b552e8d33490017c1e4a5"}},{"service_name":"Facial","service_id":"agtujlrlx","quantity":1,"employee_id":"HSSbtC8oe","employee_name":"Abhishek Sharma","total":320,"_id":{"$oid":"615b552e8d33490017c1e4a6"}},{"service_name":"Facial","service_id":"agtujlrlx","quantity":1,"employee_id":"IndhEzqMx","employee_name":"Abhinav Singh","total":400,"_id":{"$oid":"615b552e8d33490017c1e4a7"}}],"__v":0}
{"_id":{"$oid":"615c9a5a1873ff0017bd26de"},"bill_id":"CH-XUtimrvYe","user_name":"Daksh Singh","user_id":"qxRjICgll","customer_name":"Atreyi","customer_phone":7.3874827763E+10,"customer_alternative_phone":null,"customer_address":"","payment_mode":"Cash","branch_id":"KOhOskJLG","branch_name":"Dunlop Habibb","total_price":3956,"booking_amount":0,"amount_to_be_paid":3956,"service_amount":null,"date":"06-10-2021","createdOn":{"$date":"2021-10-05T18:32:58Z"},"products":[{"product_name":"Conditioner","product_id":"owtoMcxtB","quantity":1,"employee_id":"HSSbtC8oe","employee_name":"Abhishek Sharma","total":1500,"_id":{"$oid":"615c9a5a1873ff0017bd26df"}}],"services":[{"service_name":"Facial","service_id":"agtujlrlx","quantity":1,"employee_id":"CV8PZ_N9j","employee_name":"Aarav Singh","total":400,"_id":{"$oid":"615c9a5a1873ff0017bd26e0"}},{"service_name":"Facial","service_id":"agtujlrlx","quantity":1,"employee_id":"X4rvp4rOl","employee_name":"Aniket Singh","total":456,"_id":{"$oid":"615c9a5a1873ff0017bd26e1"}},{"service_name":"Facial","service_id":"agtujlrlx","quantity":1,"employee_id":"IndhEzqMx","employee_name":"Abhinav Singh","total":600,"_id":{"$oid":"615c9a5a1873ff0017bd26e2"}},{"service_name":"Hiarcut","service_id":"_lgiV_EF6","quantity":1,"employee_id":"IndhEzqMx","employee_name":"Abhinav Singh","total":1000,"_id":{"$oid":"615c9a5a1873ff0017bd26e3"}}],"__v":0}
{"_id":{"$oid":"615df8cda8cc2e0017ad67f3"},"bill_id":"CH-gZJEIBo4m","user_name":"Daksh Singh","user_id":"qxRjICgll","customer_name":"","customer_phone":null,"customer_alternative_phone":null,"customer_address":"","payment_mode":"Cash","branch_id":"KOhOskJLG","branch_name":"Dunlop Habibb","total_price":3090,"booking_amount":0,"amount_to_be_paid":3090,"service_amount":null,"date":"07-10-2021","createdOn":{"$date":"2021-10-06T19:28:13Z"},"products":[{"product_name":"Conditioner","product_id":"owtoMcxtB","quantity":1,"employee_id":"HSSbtC8oe","employee_name":"Abhishek Sharma","total":700,"_id":{"$oid":"615df8cda8cc2e0017ad67f4"}},{"product_name":"Conditioner","product_id":"owtoMcxtB","quantity":1,"employee_id":"HSSbtC8oe","employee_name":"Abhishek Sharma","total":700,"_id":{"$oid":"615df8cda8cc2e0017ad67f5"}}],"services":[{"service_name":"Facial","service_id":"agtujlrlx","quantity":1,"employee_id":"CV8PZ_N9j","employee_name":"Aarav Singh","total":500,"_id":{"$oid":"615df8cda8cc2e0017ad67f6"}},{"service_name":"Facial","service_id":"agtujlrlx","quantity":1,"employee_id":"X4rvp4rOl","employee_name":"Aniket Singh","total":500,"_id":{"$oid":"615df8cda8cc2e0017ad67f7"}},{"service_name":"Hiarcut","service_id":"_lgiV_EF6","quantity":1,"employee_id":"CV8PZ_N9j","employee_name":"Aarav Singh","total":345,"_id":{"$oid":"615df8cda8cc2e0017ad67f8"}},{"service_name":"Hiarcut","service_id":"_lgiV_EF6","quantity":1,"employee_id":"X4rvp4rOl","employee_name":"Aniket Singh","total":345,"_id":{"$oid":"615df8cda8cc2e0017ad67f9"}}],"__v":0}
{"_id":{"$oid":"615e182c50b68900173ebeeb"},"bill_id":"CH-rTemPPcJ0","user_name":"Daksh Singh","user_id":"qxRjICgll","customer_name":"","customer_phone":null,"customer_alternative_phone":null,"customer_address":"","payment_mode":"Cash","branch_id":"gW0vfq11U","branch_name":"Dunlop Habibb","total_price":1644,"booking_amount":0,"amount_to_be_paid":1644,"service_amount":null,"date":"07-10-2021","createdOn":{"$date":"2021-10-06T21:42:04Z"},"products":[],"services":[{"service_name":"Facial","service_id":"agtujlrlx","quantity":1,"employee_id":"CV8PZ_N9j","employee_name":"Aarav Singh","total":500,"_id":{"$oid":"615e182c50b68900173ebeec"}},{"service_name":"Facial","service_id":"agtujlrlx","quantity":1,"employee_id":"X4rvp4rOl","employee_name":"Aniket Singh","total":256,"_id":{"$oid":"615e182c50b68900173ebeed"}},{"service_name":"Facial","service_id":"agtujlrlx","quantity":1,"employee_id":"HSSbtC8oe","employee_name":"Abhishek Sharma","total":645,"_id":{"$oid":"615e182c50b68900173ebeee"}},{"service_name":"Hiarcut","service_id":"_lgiV_EF6","quantity":1,"employee_id":"IndhEzqMx","employee_name":"Abhinav Singh","total":243,"_id":{"$oid":"615e182c50b68900173ebeef"}}],"__v":0}
{"_id":{"$oid":"615e1cfe50b68900173ebf62"},"bill_id":"CH-ZqfGk8k4g","user_name":"Daksh Singh","user_id":"qxRjICgll","customer_name":"","customer_phone":8.240679201E+09,"customer_alternative_phone":null,"customer_address":"","payment_mode":"Cash","branch_id":"KOhOskJLG","branch_name":"Dunlop Habibb","total_price":580,"booking_amount":0,"amount_to_be_paid":580,"service_amount":null,"date":"07-10-2021","createdOn":{"$date":"2021-10-06T22:02:38Z"},"products":[],"services":[{"service_name":"Facial","service_id":"agtujlrlx","quantity":1,"employee_id":"CV8PZ_N9j","employee_name":"Aarav Singh","total":580,"_id":{"$oid":"615e1cfe50b68900173ebf63"}}],"__v":0}
{"_id":{"$oid":"615ecb1a932c1200173db621"},"bill_id":"CH-SDsjJWLfq","user_name":"Rakesh Nandi","user_id":"n-VwGbpDb","customer_name":"Jhilik ","customer_phone":7.980345401E+09,"customer_alternative_phone":null,"customer_address":"","payment_mode":"Card","branch_id":"fVj4BG0fF","branch_name":"Airport Habibb","total_price":4000,"booking_amount":0,"amount_to_be_paid":4000,"service_amount":null,"date":"07-10-2021","createdOn":{"$date":"2021-10-07T10:25:30Z"},"products":[],"services":[],"__v":0}
{"_id":{"$oid":"615ed473932c1200173db6e2"},"bill_id":"CH-xU3GBpS4z","user_name":"Rakesh Nandi","user_id":"n-VwGbpDb","customer_name":"T ROY","customer_phone":8.274918064E+09,"customer_alternative_phone":null,"customer_address":"","payment_mode":"Card","branch_id":"fVj4BG0fF","branch_name":"Airport Habibb","total_price":500,"booking_amount":0,"amount_to_be_paid":500,"service_amount":null,"date":"07-10-2021","createdOn":{"$date":"2021-10-07T11:05:23Z"},"products":[],"services":[{"service_name":"Hiarcut","service_id":"_lgiV_EF6","quantity":1,"employee_id":"5vi4Teqw-","employee_name":"Sanjay Sharma","total":500,"_id":{"$oid":"615ed473932c1200173db6e3"}}],"__v":0}
{"_id":{"$oid":"615f50b8610f950017bc6504"},"bill_id":"CH-c68ORQ35v","user_name":"Daksh Singh","user_id":"qxRjICgll","customer_name":"","customer_phone":7.635638276E+09,"customer_alternative_phone":null,"customer_address":"","payment_mode":"Cash","branch_id":"KOhOskJLG","branch_name":"Dunlop Habibb","total_price":3195,"booking_amount":0,"amount_to_be_paid":3195,"service_amount":null,"date":"08-10-2021","createdOn":{"$date":"2021-10-07T19:55:36Z"},"products":[{"product_name":"Conditioner","product_id":"owtoMcxtB","quantity":1,"employee_id":"bEgCf3Ob3","employee_name":"Mou M","total":765,"_id":{"$oid":"615f50b8610f950017bc6505"}},{"product_name":"Hair Serum","product_id":"pCNmiYZjV","quantity":1,"employee_id":"d83Zgs4KF","employee_name":"Bishal Sharma","total":345,"_id":{"$oid":"615f50b8610f950017bc6506"}}],"services":[{"service_name":"Hiarcut","service_id":"_lgiV_EF6","quantity":1,"employee_id":"CV8PZ_N9j","employee_name":"Aarav Singh","total":500,"_id":{"$oid":"615f50b8610f950017bc6507"}},{"service_name":"Hair Spa","service_id":"5VY3R4CTl","quantity":1,"employee_id":"4FWSIRRQ1","employee_name":"Chanda Choudhary","total":566,"_id":{"$oid":"615f50b8610f950017bc6508"}},{"service_name":"Scalp Treatment","service_id":"0_fL_JKMb","quantity":1,"employee_id":"xoL9X1f8W","employee_name":"Rajeshwari Singha","total":344,"_id":{"$oid":"615f50b8610f950017bc6509"}},{"service_name":"Hair Treatment","service_id":"eUB8NECWm","quantity":1,"employee_id":"xoL9X1f8W","employee_name":"Rajeshwari Singha","total":675,"_id":{"$oid":"615f50b8610f950017bc650a"}}],"__v":0}
{"_id":{"$oid":"615f5f35610f950017bc6671"},"bill_id":"CH-PBeBURYBP","user_name":"Daksh Singh","user_id":"qxRjICgll","customer_name":"aditi","customer_phone":984773732,"customer_alternative_phone":null,"customer_address":"","payment_mode":"Cash","branch_id":"KOhOskJLG","branch_name":"Dunlop Habibb","total_price":400,"booking_amount":0,"amount_to_be_paid":400,"service_amount":null,"date":"08-10-2021","createdOn":{"$date":"2021-10-07T20:57:25Z"},"products":[],"services":[{"service_name":"Hiarcut","service_id":"_lgiV_EF6","quantity":1,"employee_id":"4FWSIRRQ1","employee_name":"Chanda Choudhary","total":400,"_id":{"$oid":"615f5f35610f950017bc6672"}}],"__v":0}
{"_id":{"$oid":"615fd77a8195840017e176f1"},"bill_id":"CH-ZtqgXG872","user_name":"Rakesh Nandi","user_id":"n-VwGbpDb","customer_name":"","customer_phone":null,"customer_alternative_phone":null,"customer_address":"","payment_mode":"Card","branch_id":"fVj4BG0fF","branch_name":"Airport Habibb","total_price":500,"booking_amount":0,"amount_to_be_paid":500,"service_amount":null,"date":"08-10-2021","createdOn":{"$date":"2021-10-08T05:30:34Z"},"products":[],"services":[{"service_name":"Hiarcut","service_id":"_lgiV_EF6","quantity":1,"employee_id":null,"employee_name":"","total":500,"_id":{"$oid":"615fd77a8195840017e176f2"}}],"__v":0}
{"_id":{"$oid":"615fd78e8195840017e176f9"},"bill_id":"CH-Q-fVQRCYR","user_name":"Rakesh Nandi","user_id":"n-VwGbpDb","customer_name":"","customer_phone":null,"customer_alternative_phone":null,"customer_address":"","payment_mode":"Card","branch_id":"fVj4BG0fF","branch_name":"Airport Habibb","total_price":865,"booking_amount":0,"amount_to_be_paid":865,"service_amount":null,"date":"08-10-2021","createdOn":{"$date":"2021-10-08T05:30:54Z"},"products":[{"product_name":"Conditioner","product_id":"owtoMcxtB","quantity":1,"employee_id":null,"employee_name":"","total":365,"_id":{"$oid":"615fd78e8195840017e176fa"}}],"services":[{"service_name":"Hiarcut","service_id":"_lgiV_EF6","quantity":1,"employee_id":null,"employee_name":"","total":500,"_id":{"$oid":"615fd78e8195840017e176fb"}}],"__v":0}
{"_id":{"$oid":"6169270f62afc70017b3e204"},"bill_id":"CH-WwpVwceXV","user_name":"Rakesh Nandi","user_id":"n-VwGbpDb","customer_name":"RD","customer_phone":9.874891525E+09,"customer_alternative_phone":null,"customer_address":"","payment_mode":"Cash","branch_id":"fVj4BG0fF","branch_name":"Airport Habibb","total_price":500,"booking_amount":0,"amount_to_be_paid":500,"service_amount":null,"date":"15-10-2021","createdOn":{"$date":"2021-10-15T07:00:31Z"},"products":[],"services":[{"service_name":"Hiarcut","service_id":"_lgiV_EF6","quantity":1,"employee_id":"saUwR7UER","employee_name":"Nirmal Karan","total":500,"_id":{"$oid":"6169270f62afc70017b3e205"}}],"__v":0}
{"_id":{"$oid":"61692f03503f610017c0e000"},"bill_id":"CH-WbF5TBGAD","user_name":"Daksh Singh","user_id":"qxRjICgll","customer_name":"","customer_phone":null,"customer_alternative_phone":null,"customer_address":"","payment_mode":"Cash","branch_id":"KOhOskJLG","branch_name":"Dunlop Habibb","total_price":300,"booking_amount":0,"amount_to_be_paid":300,"service_amount":null,"date":"15-10-2021","createdOn":{"$date":"2021-10-15T07:34:27Z"},"products":[],"services":[{"service_name":"Hiarcut","service_id":"_lgiV_EF6","quantity":1,"employee_id":"CV8PZ_N9j","employee_name":"Aarav Singh","total":300,"_id":{"$oid":"61692f03503f610017c0e001"}}],"__v":0}
{"_id":{"$oid":"61692f82503f610017c0e01d"},"bill_id":"CH-Nqmjxqflo","user_name":"Daksh Singh","user_id":"qxRjICgll","customer_name":"","customer_phone":null,"customer_alternative_phone":null,"customer_address":"","payment_mode":"Cash","branch_id":"KOhOskJLG","branch_name":"Dunlop Habibb","total_price":4967,"booking_amount":0,"amount_to_be_paid":4967,"service_amount":null,"date":"15-10-2021","createdOn":{"$date":"2021-10-15T07:36:34Z"},"products":[],"services":[{"service_name":"Hair Spa","service_id":"5VY3R4CTl","quantity":1,"employee_id":"CV8PZ_N9j","employee_name":"Aarav Singh","total":400,"_id":{"$oid":"61692f82503f610017c0e01e"}},{"service_name":"Hiarcut","service_id":"_lgiV_EF6","quantity":1,"employee_id":"X4rvp4rOl","employee_name":"Aniket Singh","total":4567,"_id":{"$oid":"61692f82503f610017c0e01f"}}],"__v":0}
{"_id":{"$oid":"61695b2bbb506a00179ffa76"},"bill_id":"CH-7ZGErc1Cp","user_name":"Rakesh Nandi","user_id":"n-VwGbpDb","customer_name":"","customer_phone":null,"customer_alternative_phone":null,"customer_address":"","payment_mode":"Cash","branch_id":"fVj4BG0fF","branch_name":"Airport Habibb","total_price":1000,"booking_amount":0,"amount_to_be_paid":1000,"service_amount":null,"date":"15-10-2021","createdOn":{"$date":"2021-10-15T10:42:51Z"},"products":[],"services":[{"service_name":"Hiarcut","service_id":"_lgiV_EF6","quantity":1,"employee_id":"X4rvp4rOl","employee_name":"Aniket Singh","total":500,"_id":{"$oid":"61695b2bbb506a00179ffa77"}},{"service_name":"Hiarcut","service_id":"_lgiV_EF6","quantity":1,"employee_id":"bEgCf3Ob3","employee_name":"Mou M","total":500,"_id":{"$oid":"61695b2bbb506a00179ffa78"}}],"__v":0}
{"_id":{"$oid":"61698cf0632cd70017bbac88"},"bill_id":"CH-f_d_kikXo","user_name":"Rakesh Nandi","user_id":"n-VwGbpDb","customer_name":"aew","customer_phone":null,"customer_alternative_phone":null,"customer_address":"","payment_mode":"GPay","branch_id":"fVj4BG0fF","branch_name":"Airport Habibb","total_price":2200,"booking_amount":0,"amount_to_be_paid":2200,"service_amount":null,"date":"15-10-2021","createdOn":{"$date":"2021-10-15T14:15:12Z"},"products":[],"services":[{"service_name":"Haircut","service_id":"_lgiV_EF6","quantity":1,"employee_id":"5vi4Teqw-","employee_name":"Sanjay Sharma(chotu)","total":500,"_id":{"$oid":"61698cf0632cd70017bbac89"}},{"service_name":"Haircut","service_id":"_lgiV_EF6","quantity":1,"employee_id":"dmjjffkK0","employee_name":"Rakesh Nandi","total":1000,"_id":{"$oid":"61698cf0632cd70017bbac8a"}},{"service_name":"Haircut","service_id":"_lgiV_EF6","quantity":1,"employee_id":"5vi4Teqw-","employee_name":"Sanjay Sharma(chotu)","total":700,"_id":{"$oid":"61698cf0632cd70017bbac8b"}}],"__v":0}
{"_id":{"$oid":"616a87e3ad01ed0017f336ec"},"bill_id":"CH-pftGzvLoT","user_name":"Rakesh Nandi","user_id":"n-VwGbpDb","customer_name":"Mahamita","customer_phone":9.836941221E+09,"customer_alternative_phone":null,"customer_address":"","payment_mode":"Card Paytm SD","branch_id":"fVj4BG0fF","branch_name":"Airport Habibb","total_price":700,"booking_amount":0,"amount_to_be_paid":700,"service_amount":null,"date":"16-10-2021","createdOn":{"$date":"2021-10-16T08:05:55Z"},"products":[],"services":[{"service_name":"Haircut","service_id":"_lgiV_EF6","quantity":1,"employee_id":"saUwR7UER","employee_name":"Nirmal Karan","total":700,"_id":{"$oid":"616a87e3ad01ed0017f336ed"}}],"__v":0}
{"_id":{"$oid":"616a8a02ad01ed0017f33715"},"bill_id":"CH-6PUqnU4xo","user_name":"Rakesh Nandi","user_id":"n-VwGbpDb","customer_name":"Priyanka","customer_phone":9.330329454E+09,"customer_alternative_phone":null,"customer_address":"","payment_mode":"Cash","branch_id":"fVj4BG0fF","branch_name":"Airport Habibb","total_price":500,"booking_amount":0,"amount_to_be_paid":500,"service_amount":null,"date":"16-10-2021","createdOn":{"$date":"2021-10-16T08:14:58Z"},"products":[],"services":[{"service_name":"Haircut","service_id":"_lgiV_EF6","quantity":1,"employee_id":"saUwR7UER","employee_name":"Nirmal Karan","total":500,"_id":{"$oid":"616a8a02ad01ed0017f33716"}}],"__v":0}
{"_id":{"$oid":"616a9d52df2a580017122d66"},"bill_id":"CH-E7Pseb6e2","user_name":"Rakesh Nandi","user_id":"n-VwGbpDb","customer_name":"DIYA BASU","customer_phone":8.25062738E+09,"customer_alternative_phone":null,"customer_address":"","payment_mode":"Card Paytm SD","branch_id":"fVj4BG0fF","branch_name":"Airport Habibb","total_price":700,"booking_amount":0,"amount_to_be_paid":700,"service_amount":null,"date":"16-10-2021","createdOn":{"$date":"2021-10-16T09:37:22Z"},"products":[],"services":[{"service_name":"Haircut","service_id":"_lgiV_EF6","quantity":1,"employee_id":"saUwR7UER","employee_name":"Nirmal Karan","total":700,"_id":{"$oid":"616a9d52df2a580017122d67"}}],"__v":0}
{"_id":{"$oid":"616ad115a5d4fa0017b4cb46"},"bill_id":"CH-Ho4fS10Bt","user_name":"Ram Parvesh Thakur","user_id":"0nWOsoisT","customer_name":"ram","customer_phone":9.875605629E+09,"customer_alternative_phone":null,"customer_address":"khardah","payment_mode":"Cash","branch_id":"gW0vfq11U","branch_name":"Dunlop Habibb","total_price":5250,"booking_amount":0,"amount_to_be_paid":5250,"service_amount":null,"date":"16-10-2021","createdOn":{"$date":"2021-10-16T13:18:13Z"},"products":[],"services":[{"service_name":"Haircut","service_id":"_lgiV_EF6","quantity":1,"employee_id":null,"employee_name":"","total":250,"_id":{"$oid":"616ad115a5d4fa0017b4cb47"}},{"service_name":"Keratin Treatment","service_id":"TO1hu-EnZ","quantity":1,"employee_id":null,"employee_name":"","total":5000,"_id":{"$oid":"616ad115a5d4fa0017b4cb48"}}],"__v":0}
{"_id":{"$oid":"616bbf7c137584001797fe85"},"bill_id":"CH-824WqPRFK","user_name":"Daksh Singh","user_id":"qxRjICgll","customer_name":"","customer_phone":null,"customer_alternative_phone":null,"customer_address":"","payment_mode":"Cash","branch_id":"KOhOskJLG","branch_name":"Dunlop Habibb","total_price":500,"booking_amount":0,"amount_to_be_paid":500,"service_amount":null,"date":"17-10-2021","createdOn":{"$date":"2021-10-17T06:15:24Z"},"products":[{"product_name":"Conditioner","product_id":"owtoMcxtB","quantity":1,"employee_id":"CV8PZ_N9j","employee_name":"Aarav Singh","total":500,"_id":{"$oid":"616bbf7c137584001797fe86"}}],"services":[],"__v":0}
{"_id":{"$oid":"616bbfc2137584001797fe9d"},"bill_id":"CH-YYioa9xc6","user_name":"Daksh Singh","user_id":"qxRjICgll","customer_name":"","customer_phone":null,"customer_alternative_phone":null,"customer_address":"","payment_mode":"Cash","branch_id":"KOhOskJLG","branch_name":"Dunlop Habibb","total_price":1065,"booking_amount":0,"amount_to_be_paid":1065,"service_amount":null,"date":"17-10-2021","createdOn":{"$date":"2021-10-17T06:16:34Z"},"products":[{"product_name":"Conditioner","product_id":"owtoMcxtB","quantity":1,"employee_id":"CV8PZ_N9j","employee_name":"Aarav Singh","total":500,"_id":{"$oid":"616bbfc2137584001797fe9e"}}],"services":[{"service_name":"Haircut","service_id":"_lgiV_EF6","quantity":1,"employee_id":"IndhEzqMx","employee_name":"Abhinav Singh","total":565,"_id":{"$oid":"616bbfc2137584001797fe9f"}}],"__v":0}
{"_id":{"$oid":"616bc0a875f0ac0017012f2c"},"bill_id":"CH-gm1ulBP3C","user_name":"Daksh Singh","user_id":"qxRjICgll","customer_name":"","customer_phone":null,"customer_alternative_phone":null,"customer_address":"","payment_mode":"Cash","branch_id":"KOhOskJLG","branch_name":"Dunlop Habibb","total_price":6765,"booking_amount":0,"amount_to_be_paid":6765,"service_amount":null,"date":"17-10-2021","createdOn":{"$date":"2021-10-17T06:20:24Z"},"products":[],"services":[{"service_name":"Bridal Makeup","service_id":"Xx_AaJ-HY","quantity":1,"employee_id":"CV8PZ_N9j","employee_name":"Aarav Singh","total":6765,"_id":{"$oid":"616bc0a875f0ac0017012f2d"}}],"__v":0}
{"_id":{"$oid":"616bc23575f0ac0017012f3d"},"bill_id":"CH-DR9o3DDbW","user_name":"Daksh Singh","user_id":"qxRjICgll","customer_name":"","customer_phone":null,"customer_alternative_phone":null,"customer_address":"","payment_mode":"PhonePe","branch_id":"KOhOskJLG","branch_name":"Dunlop Habibb","total_price":7665,"booking_amount":0,"amount_to_be_paid":7665,"service_amount":null,"date":"17-10-2021","createdOn":{"$date":"2021-10-17T06:27:01Z"},"products":[{"product_name":"Conditioner","product_id":"owtoMcxtB","quantity":1,"employee_id":"ZhDco8XLt","employee_name":"Aisha Khatoon","total":500,"_id":{"$oid":"616bc23575f0ac0017012f3e"}}],"services":[{"service_name":"Bridal Makeup","service_id":"Xx_AaJ-HY","quantity":1,"employee_id":"CV8PZ_N9j","employee_name":"Aarav Singh","total":6765,"_id":{"$oid":"616bc23575f0ac0017012f3f"}},{"service_name":"Haircut","service_id":"_lgiV_EF6","quantity":1,"employee_id":"CV8PZ_N9j","employee_name":"Aarav Singh","total":400,"_id":{"$oid":"616bc23575f0ac0017012f40"}}],"__v":0}
{"_id":{"$oid":"616bc30e75f0ac0017012f5b"},"bill_id":"CH-ycYhxPCW7","user_name":"Daksh Singh","user_id":"qxRjICgll","customer_name":"","customer_phone":null,"customer_alternative_phone":null,"customer_address":"","payment_mode":"Cash","branch_id":"KOhOskJLG","branch_name":"Dunlop Habibb","total_price":567,"booking_amount":0,"amount_to_be_paid":567,"service_amount":null,"date":"17-10-2021","createdOn":{"$date":"2021-10-17T06:30:38Z"},"products":[],"services":[{"service_name":"Haircut","service_id":"_lgiV_EF6","quantity":1,"employee_id":"CV8PZ_N9j","employee_name":"Aarav Singh","total":567,"_id":{"$oid":"616bc30e75f0ac0017012f5c"}}],"__v":0}
{"_id":{"$oid":"616bc36775f0ac0017012f6e"},"bill_id":"CH-z0-NkkuAs","user_name":"Daksh Singh","user_id":"qxRjICgll","customer_name":"","customer_phone":null,"customer_alternative_phone":null,"customer_address":"","payment_mode":"Cash","branch_id":"KOhOskJLG","branch_name":"Dunlop Habibb","total_price":560,"booking_amount":0,"amount_to_be_paid":560,"service_amount":null,"date":"17-10-2021","createdOn":{"$date":"2021-10-17T06:32:07Z"},"products":[],"services":[{"service_name":"Haircut","service_id":"_lgiV_EF6","quantity":1,"employee_id":"1Uudt_EAm","employee_name":"Babai K","total":560,"_id":{"$oid":"616bc36775f0ac0017012f6f"}}],"__v":0}
{"_id":{"$oid":"616bc41775f0ac0017012f81"},"bill_id":"CH-XVjNAK-vy","user_name":"Daksh Singh","user_id":"qxRjICgll","customer_name":"","customer_phone":null,"customer_alternative_phone":null,"customer_address":"","payment_mode":"Cash","branch_id":"KOhOskJLG","branch_name":"Dunlop Habibb","total_price":40,"booking_amount":0,"amount_to_be_paid":40,"service_amount":null,"date":"17-10-2021","createdOn":{"$date":"2021-10-17T06:35:03Z"},"products":[],"services":[{"service_name":"Threading","service_id":"ud7ij2ML2","quantity":1,"employee_id":"HSSbtC8oe","employee_name":"Abhishek Sharma","total":40,"_id":{"$oid":"616bc41775f0ac0017012f82"}}],"__v":0}
{"_id":{"$oid":"616bd6bf75f0ac0017012ffd"},"bill_id":"CH-cBu49Lsc7","user_name":"Daksh singh6","user_id":"qxRjICgll","customer_name":"","customer_phone":8.777383414E+09,"customer_alternative_phone":null,"customer_address":"","payment_mode":"Cash","branch_id":"KOhOskJLG","branch_name":"Dunlop Habibb","total_price":400,"booking_amount":0,"amount_to_be_paid":400,"service_amount":null,"date":"17-10-2021","createdOn":{"$date":"2021-10-17T07:54:39Z"},"products":[],"services":[{"service_name":"Saree Draping","service_id":"0GmaJZ2yw","quantity":1,"employee_id":"CV8PZ_N9j","employee_name":"Aarav Singh","total":400,"_id":{"$oid":"616bd6bf75f0ac0017012ffe"}}],"__v":0}
{"_id":{"$oid":"616bdfd671612d00173e7b2c"},"bill_id":"CH-6UwwqIrmT","user_name":"Daksh singh6","user_id":"qxRjICgll","customer_name":"","customer_phone":7.890891405E+09,"customer_alternative_phone":null,"customer_address":"","payment_mode":"Cash","branch_id":"KOhOskJLG","branch_name":"Dunlop Habibb","total_price":254,"booking_amount":0,"amount_to_be_paid":254,"service_amount":null,"date":"17-10-2021","createdOn":{"$date":"2021-10-17T08:33:26Z"},"products":[],"services":[{"service_name":"Threading","service_id":"ud7ij2ML2","quantity":1,"employee_id":"IndhEzqMx","employee_name":"Abhinav Singh","total":254,"_id":{"$oid":"616bdfd671612d00173e7b2d"}}],"__v":0}
{"_id":{"$oid":"616c881ed32d4e00177f80c2"},"bill_id":"CH-geLjtwH6T","user_name":"Daksh singh6","user_id":"qxRjICgll","customer_name":"Anirudh","customer_phone":7.890891405E+09,"customer_alternative_phone":null,"customer_address":"","payment_mode":"Cash","branch_id":"KOhOskJLG","branch_name":"Dunlop Habibb","total_price":50,"booking_amount":0,"amount_to_be_paid":50,"service_amount":null,"date":"18-10-2021","createdOn":{"$date":"2021-10-17T20:31:26Z"},"products":[],"services":[{"service_name":"Haircut","service_id":"_lgiV_EF6","quantity":1,"employee_id":"IndhEzqMx","employee_name":"Abhinav Singh","total":50,"_id":{"$oid":"616c881ed32d4e00177f80c3"}}],"__v":0}
{"_id":{"$oid":"616c953bdd233a00178cf158"},"bill_id":"CH-f_D0dHHyB","user_name":"Rakesh Nandi","user_id":"n-VwGbpDb","customer_name":"","customer_phone":9.830891525E+09,"customer_alternative_phone":null,"customer_address":"","payment_mode":"Cash","branch_id":"fVj4BG0fF","branch_name":"Airport Habibb","total_price":110,"booking_amount":0,"amount_to_be_paid":110,"service_amount":null,"date":"18-10-2021","createdOn":{"$date":"2021-10-17T21:27:23Z"},"products":[],"services":[{"service_name":"Threading","service_id":"ud7ij2ML2","quantity":1,"employee_id":"C5pEWTlkk","employee_name":"Lipika Das","total":30,"_id":{"$oid":"616c953bdd233a00178cf159"}},{"service_name":"Threading","service_id":"ud7ij2ML2","quantity":1,"employee_id":"zfsLC2OBC","employee_name":"Baby S","total":80,"_id":{"$oid":"616c953bdd233a00178cf15a"}}],"__v":0}
{"_id":{"$oid":"616d61b0cd5f270017506bcc"},"bill_id":"CH-9ZE0b2mkQ","user_name":"Rakesh Nandi","user_id":"n-VwGbpDb","customer_name":"n bose","customer_phone":9.830724473E+09,"customer_alternative_phone":null,"customer_address":"","payment_mode":"PhonePe","branch_id":"fVj4BG0fF","branch_name":"Airport Habibb","total_price":590,"booking_amount":0,"amount_to_be_paid":590,"service_amount":null,"date":"18-10-2021","createdOn":{"$date":"2021-10-18T11:59:44Z"},"products":[],"services":[{"service_name":"Haircut","service_id":"_lgiV_EF6","quantity":1,"employee_id":"saUwR7UER","employee_name":"Nirmal Karan","total":500,"_id":{"$oid":"616d61b0cd5f270017506bcd"}},{"service_name":"Threading","service_id":"ud7ij2ML2","quantity":1,"employee_id":"xoL9X1f8W","employee_name":"Rajeshwari Singha(rimi)","total":90,"_id":{"$oid":"616d61b0cd5f270017506bce"}}],"__v":0}
{"_id":{"$oid":"616d642ecd5f270017506c22"},"bill_id":"CH-0cVb2QG-L","user_name":"Rakesh Nandi","user_id":"n-VwGbpDb","customer_name":"janvi bhattacharya","customer_phone":8.335822916E+09,"customer_alternative_phone":null,"customer_address":"","payment_mode":"PhonePe","branch_id":"fVj4BG0fF","branch_name":"Airport Habibb","total_price":700,"booking_amount":0,"amount_to_be_paid":700,"service_amount":null,"date":"18-10-2021","createdOn":{"$date":"2021-10-18T12:10:22Z"},"products":[],"services":[{"service_name":"Haircut","service_id":"_lgiV_EF6","quantity":1,"employee_id":"ZpqL1hGGA","employee_name":"Om Kumar Gupta","total":700,"_id":{"$oid":"616d642ecd5f270017506c23"}}],"__v":0}
{"_id":{"$oid":"616d7ec3dfe95a0017e13f38"},"bill_id":"CH-YWSafQmui","user_name":"Rakesh Nandi","user_id":"n-VwGbpDb","customer_name":"arit das","customer_phone":9.073749014E+09,"customer_alternative_phone":null,"customer_address":"","payment_mode":"Cash","branch_id":"fVj4BG0fF","branch_name":"Airport Habibb","total_price":300,"booking_amount":0,"amount_to_be_paid":300,"service_amount":null,"date":"18-10-2021","createdOn":{"$date":"2021-10-18T14:03:47Z"},"products":[],"services":[{"service_name":"Haircut","service_id":"_lgiV_EF6","quantity":1,"employee_id":"ZpqL1hGGA","employee_name":"Om Kumar Gupta","total":300,"_id":{"$oid":"616d7ec3dfe95a0017e13f39"}}],"__v":0}
{"_id":{"$oid":"616e7c2d43d3060017838fd8"},"bill_id":"CH-r9QCGPC57","user_name":"Rakesh Nandi","user_id":"n-VwGbpDb","customer_name":"nibedita das","customer_phone":9.330116595E+09,"customer_alternative_phone":null,"customer_address":"","payment_mode":"Cash","branch_id":"fVj4BG0fF","branch_name":"Airport Habibb","total_price":500,"booking_amount":0,"amount_to_be_paid":500,"service_amount":null,"date":"19-10-2021","createdOn":{"$date":"2021-10-19T08:05:01Z"},"products":[],"services":[{"service_name":"Haircut","service_id":"_lgiV_EF6","quantity":1,"employee_id":"ZpqL1hGGA","employee_name":"Om Kumar Gupta","total":500,"_id":{"$oid":"616e7c2d43d3060017838fd9"}}],"__v":0}
{"_id":{"$oid":"616ed6cbc6ef050017250004"},"bill_id":"CH-CE_mI6zaq","user_name":"Rakesh Nandi","user_id":"n-VwGbpDb","customer_name":"arpita sarkar","customer_phone":7.890446533E+09,"customer_alternative_phone":null,"customer_address":"","payment_mode":"Cash","branch_id":"fVj4BG0fF","branch_name":"Airport Habibb","total_price":70,"booking_amount":0,"amount_to_be_paid":70,"service_amount":null,"date":"19-10-2021","createdOn":{"$date":"2021-10-19T14:31:39Z"},"products":[],"services":[{"service_name":"Threading","service_id":"ud7ij2ML2","quantity":1,"employee_id":"4FWSIRRQ1","employee_name":"Chanda Choudhary","total":70,"_id":{"$oid":"616ed6cbc6ef050017250005"}}],"__v":0}
{"_id":{"$oid":"6170201bd92066001710a1e4"},"bill_id":"CH-ovfiCpdoz","user_name":"Ram Parvesh Thakur","user_id":"0nWOsoisT","customer_name":"p paul","customer_phone":9.073423844E+09,"customer_alternative_phone":null,"customer_address":"","payment_mode":"Card Paytm SD","branch_id":"gW0vfq11U","branch_name":"Dunlop Habibb","total_price":4500,"booking_amount":0,"amount_to_be_paid":4500,"service_amount":null,"date":"20-10-2021","createdOn":{"$date":"2021-10-20T13:56:43Z"},"products":[],"services":[{"service_name":"Facial","service_id":"vgt1iq9xt","quantity":1,"employee_id":"6RntEuqEY","employee_name":"Riya Sengupta","total":3800,"_id":{"$oid":"6170201bd92066001710a1e5"}},{"service_name":"Shampoo / Blowdry / Setting","service_id":"IKnr-umbQ","quantity":1,"employee_id":"Az8kgfy5i","employee_name":"Gulshan Bano","total":700,"_id":{"$oid":"6170201bd92066001710a1e6"}}],"__v":0}
{"_id":{"$oid":"617021d2d92066001710a212"},"bill_id":"CH--mKr0gWD6","user_name":"Dunlop  POS 1","user_id":"GXj8dQsbD","customer_name":"rumki ","customer_phone":9.163959132E+09,"customer_alternative_phone":null,"customer_address":"","payment_mode":"Cash","branch_id":"gW0vfq11U","branch_name":"Dunlop Habibb","total_price":1663,"booking_amount":0,"amount_to_be_paid":1663,"service_amount":null,"date":"20-10-2021","createdOn":{"$date":"2021-10-20T14:04:02Z"},"products":[{"product_name":"Marula Oil","product_id":"dAhmo8YMt","quantity":1,"employee_id":"gRo3RP5_J","employee_name":"Mukti Mohanty","total":1663,"_id":{"$oid":"617021d2d92066001710a213"}}],"services":[],"__v":0}
{"_id":{"$oid":"61702290d92066001710a22f"},"bill_id":"CH-1StpODSfz","user_name":"Dunlop  POS 1","user_id":"GXj8dQsbD","customer_name":"8820802384","customer_phone":null,"customer_alternative_phone":null,"customer_address":"","payment_mode":"Cash","branch_id":"gW0vfq11U","branch_name":"Dunlop Habibb","total_price":70,"booking_amount":0,"amount_to_be_paid":70,"service_amount":null,"date":"20-10-2021","createdOn":{"$date":"2021-10-20T14:07:12Z"},"products":[],"services":[{"service_name":"Threading","service_id":"ud7ij2ML2","quantity":1,"employee_id":"6RntEuqEY","employee_name":"Riya Sengupta","total":70,"_id":{"$oid":"61702290d92066001710a230"}}],"__v":0}
{"_id":{"$oid":"6170240bd92066001710a263"},"bill_id":"CH-Xh9ace8rX","user_name":"Dunlop  POS 1","user_id":"GXj8dQsbD","customer_name":"priyanka tiwari","customer_phone":8.017103123E+09,"customer_alternative_phone":null,"customer_address":"","payment_mode":"Card Paytm SD","branch_id":"gW0vfq11U","branch_name":"Dunlop Habibb","total_price":530,"booking_amount":0,"amount_to_be_paid":530,"service_amount":null,"date":"20-10-2021","createdOn":{"$date":"2021-10-20T14:13:31Z"},"products":[],"services":[{"service_name":"Haircut","service_id":"_lgiV_EF6","quantity":1,"employee_id":"yPknaFt9A","employee_name":"Asish Sarkar","total":500,"_id":{"$oid":"6170240bd92066001710a264"}},{"service_name":"Threading","service_id":"ud7ij2ML2","quantity":1,"employee_id":"6RntEuqEY","employee_name":"Riya Sengupta","total":30,"_id":{"$oid":"6170240bd92066001710a265"}}],"__v":0}
{"_id":{"$oid":"617025c2d92066001710a283"},"bill_id":"CH-CMFfC1Bhj","user_name":"Dunlop  POS 1","user_id":"GXj8dQsbD","customer_name":"sangita ","customer_phone":8.697584745E+09,"customer_alternative_phone":null,"customer_address":"","payment_mode":"Card Paytm ET","branch_id":"gW0vfq11U","branch_name":"Dunlop Habibb","total_price":2700,"booking_amount":0,"amount_to_be_paid":2700,"service_amount":null,"date":"20-10-2021","createdOn":{"$date":"2021-10-20T14:20:50Z"},"products":[],"services":[{"service_name":"Facial","service_id":"vgt1iq9xt","quantity":1,"employee_id":"GhAk7n-Kj","employee_name":"Shruti  Agarwal","total":2700,"_id":{"$oid":"617025c2d92066001710a284"}}],"__v":0}
{"_id":{"$oid":"61702669d92066001710a29e"},"bill_id":"CH-o5QTDObuV","user_name":"Dunlop  POS 1","user_id":"GXj8dQsbD","customer_name":"a mukherjee","customer_phone":null,"customer_alternative_phone":null,"customer_address":"","payment_mode":"PhonePe","branch_id":"gW0vfq11U","branch_name":"Dunlop Habibb","total_price":250,"booking_amount":0,"amount_to_be_paid":250,"service_amount":null,"date":"20-10-2021","createdOn":{"$date":"2021-10-20T14:23:37Z"},"products":[],"services":[{"service_name":"Shaving/Trimming/Sculpting","service_id":"za2ayR7-c","quantity":1,"employee_id":"yPknaFt9A","employee_name":"Asish Sarkar","total":250,"_id":{"$oid":"61702669d92066001710a29f"}}],"__v":0}
{"_id":{"$oid":"61702739d92066001710a2c2"},"bill_id":"CH-vVUARHcjr","user_name":"Dunlop  POS 1","user_id":"GXj8dQsbD","customer_name":"","customer_phone":7.780241626E+09,"customer_alternative_phone":null,"customer_address":"","payment_mode":"Cash","branch_id":"gW0vfq11U","branch_name":"Dunlop Habibb","total_price":90,"booking_amount":0,"amount_to_be_paid":90,"service_amount":null,"date":"20-10-2021","createdOn":{"$date":"2021-10-20T14:27:05Z"},"products":[],"services":[{"service_name":"Threading","service_id":"ud7ij2ML2","quantity":1,"employee_id":"Az8kgfy5i","employee_name":"Gulshan Bano","total":90,"_id":{"$oid":"61702739d92066001710a2c3"}}],"__v":0}
{"_id":{"$oid":"617027edd92066001710a2fd"},"bill_id":"CH-NdqT0dAyd","user_name":"Dunlop  POS 1","user_id":"GXj8dQsbD","customer_name":"himadi","customer_phone":9.002820939E+09,"customer_alternative_phone":null,"customer_address":"","payment_mode":"Cash","branch_id":"gW0vfq11U","branch_name":"Dunlop Habibb","total_price":100,"booking_amount":0,"amount_to_be_paid":100,"service_amount":null,"date":"20-10-2021","createdOn":{"$date":"2021-10-20T14:30:05Z"},"products":[],"services":[{"service_name":"Shaving/Trimming/Sculpting","service_id":"za2ayR7-c","quantity":1,"employee_id":"cdMvhqHoj","employee_name":"Shakil Ahmed","total":100,"_id":{"$oid":"617027edd92066001710a2fe"}}],"__v":0}
{"_id":{"$oid":"6170285ed92066001710a325"},"bill_id":"CH-cvk763jnQ","user_name":"Dunlop  POS 1","user_id":"GXj8dQsbD","customer_name":"sushmita","customer_phone":9.87445711E+09,"customer_alternative_phone":null,"customer_address":"","payment_mode":"GPay","branch_id":"gW0vfq11U","branch_name":"Dunlop Habibb","total_price":1350,"booking_amount":0,"amount_to_be_paid":1350,"service_amount":null,"date":"20-10-2021","createdOn":{"$date":"2021-10-20T14:31:58Z"},"products":[],"services":[{"service_name":"Facial","service_id":"vgt1iq9xt","quantity":1,"employee_id":"Az8kgfy5i","employee_name":"Gulshan Bano","total":1350,"_id":{"$oid":"6170285ed92066001710a326"}}],"__v":0}
{"_id":{"$oid":"61702e8ed92066001710a359"},"bill_id":"CH-9eqkA9ZJE","user_name":"Dunlop  POS 1","user_id":"GXj8dQsbD","customer_name":"jayita ","customer_phone":8.777024434E+09,"customer_alternative_phone":null,"customer_address":"","payment_mode":"Cash","branch_id":"gW0vfq11U","branch_name":"Dunlop Habibb","total_price":8000,"booking_amount":0,"amount_to_be_paid":8000,"service_amount":null,"date":"20-10-2021","createdOn":{"$date":"2021-10-20T14:58:22Z"},"products":[],"services":[{"service_name":"Smoothing / Straightening","service_id":"yjpGVwSon","quantity":1,"employee_id":"6RntEuqEY","employee_name":"Riya Sengupta","total":8000,"_id":{"$oid":"61702e8ed92066001710a35a"}}],"__v":0}
{"_id":{"$oid":"61710700284f0000176895ea"},"bill_id":"CH-K4A6v_QII","user_name":"Rakesh Nandi","user_id":"n-VwGbpDb","customer_name":"piu paul","customer_phone":9.051574878E+09,"customer_alternative_phone":null,"customer_address":"","payment_mode":"Cash","branch_id":"fVj4BG0fF","branch_name":"Airport Habibb","total_price":250,"booking_amount":0,"amount_to_be_paid":250,"service_amount":null,"date":"21-10-2021","createdOn":{"$date":"2021-10-21T06:21:52Z"},"products":[],"services":[{"service_name":"Shampoo Blowdry L'oréal","service_id":"9UZwaWDAp","quantity":1,"employee_id":"XBvUDuwPy","employee_name":"Deepak Das","total":250,"_id":{"$oid":"61710700284f0000176895eb"}}],"__v":0}
{"_id":{"$oid":"61710824284f000017689609"},"bill_id":"CH-f3AyL_kxk","user_name":"Rakesh Nandi","user_id":"n-VwGbpDb","customer_name":"puja","customer_phone":7.358058949E+09,"customer_alternative_phone":null,"customer_address":"","payment_mode":"GPay","branch_id":"fVj4BG0fF","branch_name":"Airport Habibb","total_price":1340,"booking_amount":0,"amount_to_be_paid":1340,"service_amount":null,"date":"21-10-2021","createdOn":{"$date":"2021-10-21T06:26:44Z"},"products":[],"services":[{"service_name":"Clean-up VLCC","service_id":"B_ASbtuh4","quantity":1,"employee_id":"4FWSIRRQ1","employee_name":"Chanda Choudhary","total":700,"_id":{"$oid":"61710824284f00001768960a"}},{"service_name":"De- Tan Normal","service_id":"JBj3N3xR8","quantity":1,"employee_id":"4FWSIRRQ1","employee_name":"Chanda Choudhary","total":600,"_id":{"$oid":"61710824284f00001768960b"}},{"service_name":"Threading","service_id":"ud7ij2ML2","quantity":1,"employee_id":"4FWSIRRQ1","employee_name":"Chanda Choudhary","total":40,"_id":{"$oid":"61710824284f00001768960c"}}],"__v":0}
{"_id":{"$oid":"61711f94b325fb001720d6bb"},"bill_id":"CH-41j9k5Oxi","user_name":"Ram Parvesh Thakur","user_id":"0nWOsoisT","customer_name":"ram ","customer_phone":9.875605629E+09,"customer_alternative_phone":null,"customer_address":"","payment_mode":"GPay","branch_id":"gW0vfq11U","branch_name":"Dunlop Habibb","total_price":500,"booking_amount":0,"amount_to_be_paid":500,"service_amount":null,"date":"21-10-2021","createdOn":{"$date":"2021-10-21T08:06:44Z"},"products":[],"services":[{"service_name":"Haircut","service_id":"_lgiV_EF6","quantity":1,"employee_id":"3vzoa3XcV","employee_name":"Bapi Biswas","total":500,"_id":{"$oid":"61711f94b325fb001720d6bc"}}],"__v":0}
{"_id":{"$oid":"61712164b325fb001720d746"},"bill_id":"CH-hhphxrEFa","user_name":"Rakesh Nandi","user_id":"n-VwGbpDb","customer_name":"saarnav","customer_phone":9.674283016E+09,"customer_alternative_phone":null,"customer_address":"","payment_mode":"Cash","branch_id":"fVj4BG0fF","branch_name":"Airport Habibb","total_price":300,"booking_amount":0,"amount_to_be_paid":300,"service_amount":null,"date":"21-10-2021","createdOn":{"$date":"2021-10-21T08:14:28Z"},"products":[],"services":[{"service_name":"Haircut","service_id":"_lgiV_EF6","quantity":1,"employee_id":"XBvUDuwPy","employee_name":"Deepak Das","total":300,"_id":{"$oid":"61712164b325fb001720d747"}}],"__v":0}
{"_id":{"$oid":"6171219bb325fb001720d75d"},"bill_id":"CH-iH0Ydpjvi","user_name":"Ram Parvesh Thakur","user_id":"0nWOsoisT","customer_name":"ram ","customer_phone":9.875605629E+09,"customer_alternative_phone":null,"customer_address":"","payment_mode":"GPay","branch_id":"gW0vfq11U","branch_name":"Dunlop Habibb","total_price":400,"booking_amount":0,"amount_to_be_paid":400,"service_amount":null,"date":"21-10-2021","createdOn":{"$date":"2021-10-21T08:15:23Z"},"products":[],"services":[{"service_name":"Haircut","service_id":"_lgiV_EF6","quantity":1,"employee_id":"yPknaFt9A","employee_name":"Asish Sarkar","total":400,"_id":{"$oid":"6171219bb325fb001720d75e"}}],"__v":0}
{"_id":{"$oid":"617127bbb325fb001720d7d5"},"bill_id":"CH-7YtYaTHPv","user_name":"Ram Parvesh Thakur","user_id":"0nWOsoisT","customer_name":"ram","customer_phone":9.875605629E+09,"customer_alternative_phone":null,"customer_address":"","payment_mode":"GPay","branch_id":"gW0vfq11U","branch_name":"Dunlop Habibb","total_price":700,"booking_amount":0,"amount_to_be_paid":700,"service_amount":null,"date":"21-10-2021","createdOn":{"$date":"2021-10-21T08:41:31Z"},"products":[],"services":[{"service_name":"Haircut","service_id":"_lgiV_EF6","quantity":1,"employee_id":"Ryd5M3J-9","employee_name":"Riya Sengupta","total":700,"_id":{"$oid":"617127bbb325fb001720d7d6"}}],"__v":0}
{"_id":{"$oid":"617129e3b325fb001720d86d"},"bill_id":"CH-9ztyNZKFI","user_name":"Ram Parvesh Thakur","user_id":"0nWOsoisT","customer_name":"ram","customer_phone":9.875605629E+09,"customer_alternative_phone":null,"customer_address":"","payment_mode":"GPay","branch_id":"gW0vfq11U","branch_name":"Dunlop Habibb","total_price":800,"booking_amount":0,"amount_to_be_paid":800,"service_amount":null,"date":"21-10-2021","createdOn":{"$date":"2021-10-21T08:50:43Z"},"products":[],"services":[{"service_name":"Waxing Normal Hands Full ","service_id":"BzUoHpTE8","quantity":1,"employee_id":"Az8kgfy5i","employee_name":"Gulshan Bano","total":800,"_id":{"$oid":"617129e3b325fb001720d86e"}}],"__v":0}
{"_id":{"$oid":"61716a43c7e2770017e424b5"},"bill_id":"CH-Qi0No44Ou","user_name":"Rakesh Nandi","user_id":"n-VwGbpDb","customer_name":"n bose","customer_phone":9.830724473E+09,"customer_alternative_phone":null,"customer_address":"","payment_mode":"Card Paytm SD","branch_id":"fVj4BG0fF","branch_name":"Airport Habibb","total_price":2500,"booking_amount":0,"amount_to_be_paid":2500,"service_amount":null,"date":"21-10-2021","createdOn":{"$date":"2021-10-21T13:25:23Z"},"products":[],"services":[{"service_name":"Hair Spa SP","service_id":"YV7Q_fQNR","quantity":1,"employee_id":"4FWSIRRQ1","employee_name":"Chanda Choudhary","total":2500,"_id":{"$oid":"61716a43c7e2770017e424b6"}}],"__v":0}
{"_id":{"$oid":"6171728ac7e2770017e42501"},"bill_id":"CH-l1670QQWx","user_name":"Rakesh Nandi","user_id":"n-VwGbpDb","customer_name":"soma mitra","customer_phone":7.980270637E+09,"customer_alternative_phone":null,"customer_address":"","payment_mode":"Card Paytm SD","branch_id":"fVj4BG0fF","branch_name":"Airport Habibb","total_price":550,"booking_amount":0,"amount_to_be_paid":550,"service_amount":null,"date":"21-10-2021","createdOn":{"$date":"2021-10-21T14:00:42Z"},"products":[],"services":[{"service_name":"Haircut","service_id":"_lgiV_EF6","quantity":1,"employee_id":"ZpqL1hGGA","employee_name":"Om Kumar Gupta","total":500,"_id":{"$oid":"6171728ac7e2770017e42502"}},{"service_name":"Threading","service_id":"ud7ij2ML2","quantity":1,"employee_id":"xoL9X1f8W","employee_name":"Rajeshwari Singha(rimi)","total":50,"_id":{"$oid":"6171728ac7e2770017e42503"}}],"__v":0}
{"_id":{"$oid":"61717fb6872d820017fe984f"},"bill_id":"CH-2a5x7SIiI","user_name":"Ram Parvesh Thakur","user_id":"0nWOsoisT","customer_name":"","customer_phone":9.836927341E+09,"customer_alternative_phone":null,"customer_address":"","payment_mode":"Cash","branch_id":"gW0vfq11U","branch_name":"Dunlop Habibb","total_price":150,"booking_amount":0,"amount_to_be_paid":150,"service_amount":null,"date":"21-10-2021","createdOn":{"$date":"2021-10-21T14:56:54Z"},"products":[],"services":[{"service_name":"Haircut","service_id":"_lgiV_EF6","quantity":1,"employee_id":"yPknaFt9A","employee_name":"Asish Sarkar","total":150,"_id":{"$oid":"61717fb6872d820017fe9850"}}],"__v":0}
{"_id":{"$oid":"61718020872d820017fe9861"},"bill_id":"CH--hqMoH8-d","user_name":"Dunlop  POS 1","user_id":"GXj8dQsbD","customer_name":"","customer_phone":9.434362155E+09,"customer_alternative_phone":null,"customer_address":"","payment_mode":"Cash","branch_id":"gW0vfq11U","branch_name":"Dunlop Habibb","total_price":60,"booking_amount":0,"amount_to_be_paid":60,"service_amount":null,"date":"21-10-2021","createdOn":{"$date":"2021-10-21T14:58:40Z"},"products":[],"services":[{"service_name":"Threading","service_id":"ud7ij2ML2","quantity":1,"employee_id":"Ryd5M3J-9","employee_name":"Riya Sengupta","total":60,"_id":{"$oid":"61718020872d820017fe9862"}}],"__v":0}
{"_id":{"$oid":"61718088872d820017fe987e"},"bill_id":"CH-YenzOYMnV","user_name":"Dunlop  POS 1","user_id":"GXj8dQsbD","customer_name":"nandini pal","customer_phone":8.100270035E+09,"customer_alternative_phone":null,"customer_address":"","payment_mode":"Cash","branch_id":"gW0vfq11U","branch_name":"Dunlop Habibb","total_price":500,"booking_amount":0,"amount_to_be_paid":500,"service_amount":null,"date":"21-10-2021","createdOn":{"$date":"2021-10-21T15:00:24Z"},"products":[],"services":[{"service_name":"Haircut","service_id":"_lgiV_EF6","quantity":1,"employee_id":"Ryd5M3J-9","employee_name":"Riya Sengupta","total":500,"_id":{"$oid":"61718088872d820017fe987f"}}],"__v":0}
{"_id":{"$oid":"617180d8872d820017fe989a"},"bill_id":"CH-dvG6mDLJ7","user_name":"Dunlop  POS 1","user_id":"GXj8dQsbD","customer_name":"","customer_phone":9.874222272E+09,"customer_alternative_phone":null,"customer_address":"","payment_mode":"Cash","branch_id":"gW0vfq11U","branch_name":"Dunlop Habibb","total_price":500,"booking_amount":0,"amount_to_be_paid":500,"service_amount":null,"date":"21-10-2021","createdOn":{"$date":"2021-10-21T15:01:44Z"},"products":[],"services":[{"service_name":"Haircut","service_id":"_lgiV_EF6","quantity":1,"employee_id":"3vzoa3XcV","employee_name":"Bapi Biswas","total":500,"_id":{"$oid":"617180d8872d820017fe989b"}}],"__v":0}
{"_id":{"$oid":"61718177872d820017fe98b6"},"bill_id":"CH-zIjM_Bvs7","user_name":"Dunlop  POS 1","user_id":"GXj8dQsbD","customer_name":"","customer_phone":7.003925508E+09,"customer_alternative_phone":null,"customer_address":"","payment_mode":"Cash","branch_id":"gW0vfq11U","branch_name":"Dunlop Habibb","total_price":30,"booking_amount":0,"amount_to_be_paid":30,"service_amount":null,"date":"21-10-2021","createdOn":{"$date":"2021-10-21T15:04:23Z"},"products":[],"services":[{"service_name":"Threading","service_id":"ud7ij2ML2","quantity":1,"employee_id":"GhAk7n-Kj","employee_name":"Shruti  Agarwal","total":30,"_id":{"$oid":"61718177872d820017fe98b7"}}],"__v":0}
{"_id":{"$oid":"61718212872d820017fe98d5"},"bill_id":"CH-Wr16CB5WI","user_name":"Dunlop  POS 1","user_id":"GXj8dQsbD","customer_name":"amit","customer_phone":9.8393464E+09,"customer_alternative_phone":null,"customer_address":"","payment_mode":"Card Paytm SD","branch_id":"gW0vfq11U","branch_name":"Dunlop Habibb","total_price":1350,"booking_amount":0,"amount_to_be_paid":1350,"service_amount":null,"date":"21-10-2021","createdOn":{"$date":"2021-10-21T15:06:58Z"},"products":[{"product_name":"Keratin Shampoo 250ml","product_id":"MMpzD-E-6","quantity":1,"employee_id":"gRo3RP5_J","employee_name":"Mukti Mohanty","total":1350,"_id":{"$oid":"61718212872d820017fe98d6"}}],"services":[],"__v":0}
{"_id":{"$oid":"6171829b872d820017fe98f6"},"bill_id":"CH-fizkoHs3h","user_name":"Dunlop  POS 1","user_id":"GXj8dQsbD","customer_name":"mampi das","customer_phone":8.336025274E+09,"customer_alternative_phone":null,"customer_address":"","payment_mode":"GPay","branch_id":"gW0vfq11U","branch_name":"Dunlop Habibb","total_price":3650,"booking_amount":0,"amount_to_be_paid":3650,"service_amount":null,"date":"21-10-2021","createdOn":{"$date":"2021-10-21T15:09:15Z"},"products":[{"product_name":"Keratin Smooth Perfect Shampoo","product_id":"pVWtM2b92","quantity":1,"employee_id":"gRo3RP5_J","employee_name":"Mukti Mohanty","total":900,"_id":{"$oid":"6171829b872d820017fe98f7"}},{"product_name":"Moisture Kick Treatment","product_id":"xiSZNAdvV","quantity":1,"employee_id":"gRo3RP5_J","employee_name":"Mukti Mohanty","total":1000,"_id":{"$oid":"6171829b872d820017fe98f8"}},{"product_name":"Rose Oil","product_id":"Si26HIxL6","quantity":1,"employee_id":"gRo3RP5_J","employee_name":"Mukti Mohanty","total":1750,"_id":{"$oid":"6171829b872d820017fe98f9"}}],"services":[],"__v":0}
{"_id":{"$oid":"617196b8ccda530017d2436d"},"bill_id":"CH-5P5XxmxSY","user_name":"Dunlop  POS 1","user_id":"GXj8dQsbD","customer_name":"","customer_phone":9.831582019E+09,"customer_alternative_phone":null,"customer_address":"","payment_mode":"Cash","branch_id":"gW0vfq11U","branch_name":"Dunlop Habibb","total_price":100,"booking_amount":0,"amount_to_be_paid":100,"service_amount":null,"date":"21-10-2021","createdOn":{"$date":"2021-10-21T16:35:04Z"},"products":[],"services":[{"service_name":"Threading","service_id":"ud7ij2ML2","quantity":1,"employee_id":"Ryd5M3J-9","employee_name":"Riya Sengupta","total":100,"_id":{"$oid":"617196b8ccda530017d2436e"}}],"__v":0}
{"_id":{"$oid":"617197cfccda530017d243b3"},"bill_id":"CH-N4ZpfPitU","user_name":"Dunlop  POS 1","user_id":"GXj8dQsbD","customer_name":"","customer_phone":7.278784438E+09,"customer_alternative_phone":null,"customer_address":"","payment_mode":"Cash","branch_id":"gW0vfq11U","branch_name":"Dunlop Habibb","total_price":1350,"booking_amount":0,"amount_to_be_paid":1350,"service_amount":null,"date":"21-10-2021","createdOn":{"$date":"2021-10-21T16:39:43Z"},"products":[],"services":[{"service_name":"Haircut","service_id":"_lgiV_EF6","quantity":1,"employee_id":"3vzoa3XcV","employee_name":"Bapi Biswas","total":250,"_id":{"$oid":"617197cfccda530017d243b4"}},{"service_name":"Beard Trimming/ Sculpting/ Clean Shave","service_id":"za2ayR7-c","quantity":1,"employee_id":"3vzoa3XcV","employee_name":"Bapi Biswas","total":100,"_id":{"$oid":"617197cfccda530017d243b5"}},{"service_name":"Highlights Schwarzkopf","service_id":"U7jQ7wjiN","quantity":1,"employee_id":"d83Zgs4KF","employee_name":"Bishal Sharma","total":1000,"_id":{"$oid":"617197cfccda530017d243b6"}}],"__v":0}
{"_id":{"$oid":"61728bdabcaa5100177dc3a8"},"bill_id":"CH-8gSRXEAab","user_name":"Dunlop  POS 1","user_id":"GXj8dQsbD","customer_name":"d bose","customer_phone":8.910193836E+09,"customer_alternative_phone":null,"customer_address":"","payment_mode":"Cash","branch_id":"gW0vfq11U","branch_name":"Dunlop Habibb","total_price":250,"booking_amount":0,"amount_to_be_paid":250,"service_amount":null,"date":"22-10-2021","createdOn":{"$date":"2021-10-22T10:00:58Z"},"products":[],"services":[{"service_name":"Haircut","service_id":"_lgiV_EF6","quantity":1,"employee_id":"yPknaFt9A","employee_name":"Asish Sarkar","total":250,"_id":{"$oid":"61728bdabcaa5100177dc3a9"}}],"__v":0}
{"_id":{"$oid":"61728d13bcaa5100177dc3c9"},"bill_id":"CH-d4J4juKBc","user_name":"Dunlop  POS 1","user_id":"GXj8dQsbD","customer_name":"","customer_phone":8.777479114E+09,"customer_alternative_phone":null,"customer_address":"","payment_mode":"Cash","branch_id":"gW0vfq11U","branch_name":"Dunlop Habibb","total_price":1762,"booking_amount":0,"amount_to_be_paid":1762,"service_amount":null,"date":"22-10-2021","createdOn":{"$date":"2021-10-22T10:06:11Z"},"products":[{"product_name":"Xtenso Sulphate Free Shampoo","product_id":"wDONKEZS4","quantity":1,"employee_id":"3vzoa3XcV","employee_name":"Bapi Biswas","total":831,"_id":{"$oid":"61728d13bcaa5100177dc3ca"}},{"product_name":"Xtenso Sulphate Free Mask","product_id":"9ptUJsh1e","quantity":1,"employee_id":"3vzoa3XcV","employee_name":"Bapi Biswas","total":931,"_id":{"$oid":"61728d13bcaa5100177dc3cb"}}],"services":[],"__v":0}
{"_id":{"$oid":"6172f60e4338350017d4c115"},"bill_id":"CH-nIz-kHni0","user_name":"Daksh singh6","user_id":"qxRjICgll","customer_name":"","customer_phone":null,"customer_alternative_phone":null,"customer_address":"","payment_mode":"Cash","branch_id":"KOhOskJLG","branch_name":"Dunlop Habibb","total_price":1973,"booking_amount":0,"amount_to_be_paid":1973,"service_amount":null,"date":"22-10-2021","createdOn":{"$date":"2021-10-22T17:34:06Z"},"products":[{"product_name":"Comb","product_id":"4tQ1LbI2q","quantity":1,"employee_id":"HSSbtC8oe","employee_name":"Abhishek Sharma","total":346,"_id":{"$oid":"6172f60e4338350017d4c116"}},{"product_name":"Section Clips","product_id":"-g4qyIXFL","quantity":1,"employee_id":"X4rvp4rOl","employee_name":"Aniket Singh","total":543,"_id":{"$oid":"6172f60e4338350017d4c117"}}],"services":[{"service_name":"Haircut","service_id":"_lgiV_EF6","quantity":1,"employee_id":"zfsLC2OBC","employee_name":"Baby S","total":765,"_id":{"$oid":"6172f60e4338350017d4c118"}},{"service_name":"Threading","service_id":"ud7ij2ML2","quantity":1,"employee_id":"3vzoa3XcV","employee_name":"Bapi Biswas","total":87,"_id":{"$oid":"6172f60e4338350017d4c119"}},{"service_name":"Beard Trimming/ Sculpting/ Clean Shave","service_id":"za2ayR7-c","quantity":1,"employee_id":"1Uudt_EAm","employee_name":"Babai K","total":232,"_id":{"$oid":"6172f60e4338350017d4c11a"}}],"__v":0}
{"_id":{"$oid":"6173082b016a2b001795afab"},"bill_id":"CH-Y0lucKKA7","user_name":"Daksh singh6","user_id":"qxRjICgll","customer_name":"","customer_phone":null,"customer_alternative_phone":null,"customer_address":"","payment_mode":"Cash","branch_id":"KOhOskJLG","branch_name":"Dunlop Habibb","total_price":6001,"booking_amount":0,"amount_to_be_paid":6001,"service_amount":null,"date":"23-10-2021","createdOn":{"$date":"2021-10-22T18:51:23Z"},"products":[{"product_name":"Deep Pore Cleansing Facewash","product_id":"tKpONh01Y","quantity":1,"employee_id":"ZhDco8XLt","employee_name":"Aisha Khatoon","total":540,"_id":{"$oid":"6173082b016a2b001795afac"}},{"product_name":"Whitening & Brightening Facewash","product_id":"-g3USJ9Z1","quantity":1,"employee_id":"HSSbtC8oe","employee_name":"Abhishek Sharma","total":600,"_id":{"$oid":"6173082b016a2b001795afad"}},{"product_name":"Whitening & Brightening Day Cream","product_id":"pf7b3TN2T","quantity":1,"employee_id":"HSSbtC8oe","employee_name":"Abhishek Sharma","total":1000,"_id":{"$oid":"6173082b016a2b001795afae"}},{"product_name":"Whitening & Brightening Night Cream","product_id":"tMgX72vnA","quantity":1,"employee_id":"1Uudt_EAm","employee_name":"Babai K","total":500,"_id":{"$oid":"6173082b016a2b001795afaf"}},{"product_name":"Anti Blemish Cream","product_id":"iM7YwicQO","quantity":1,"employee_id":"HSSbtC8oe","employee_name":"Abhishek Sharma","total":650,"_id":{"$oid":"6173082b016a2b001795afb0"}},{"product_name":"Deep Moisture Cream","product_id":"w57IPcffz","quantity":1,"employee_id":"ZhDco8XLt","employee_name":"Aisha Khatoon","total":700,"_id":{"$oid":"6173082b016a2b001795afb1"}}],"services":[{"service_name":"Haircut","service_id":"_lgiV_EF6","quantity":1,"employee_id":"HSSbtC8oe","employee_name":"Abhishek Sharma","total":852,"_id":{"$oid":"6173082b016a2b001795afb2"}},{"service_name":"Threading","service_id":"ud7ij2ML2","quantity":1,"employee_id":"HSSbtC8oe","employee_name":"Abhishek Sharma","total":655,"_id":{"$oid":"6173082b016a2b001795afb3"}},{"service_name":"Beard Trimming/ Sculpting/ Clean Shave","service_id":"za2ayR7-c","quantity":1,"employee_id":"X4rvp4rOl","employee_name":"Aniket Singh","total":504,"_id":{"$oid":"6173082b016a2b001795afb4"}}],"__v":0}
{"_id":{"$oid":"617308f3016a2b001795afe3"},"bill_id":"CH-uFiywYLRc","user_name":"Daksh singh6","user_id":"qxRjICgll","customer_name":"","customer_phone":null,"customer_alternative_phone":null,"customer_address":"","payment_mode":"Cash","branch_id":"KOhOskJLG","branch_name":"Dunlop Habibb","total_price":554,"booking_amount":0,"amount_to_be_paid":554,"service_amount":null,"date":"23-10-2021","createdOn":{"$date":"2021-10-22T18:54:43Z"},"products":[],"services":[{"service_name":"Haircut","service_id":"_lgiV_EF6","quantity":1,"employee_id":"HSSbtC8oe","employee_name":"Abhishek Sharma","total":554,"_id":{"$oid":"617308f3016a2b001795afe4"}}],"__v":0}
{"_id":{"$oid":"6174290d3d69ac0017df4779"},"bill_id":"CH-fiy1hPa2L","user_name":"Dunlop  POS 1","user_id":"GXj8dQsbD","customer_name":"","customer_phone":8.240809808E+09,"customer_alternative_phone":null,"customer_address":"","payment_mode":"Card Paytm SD","branch_id":"gW0vfq11U","branch_name":"Dunlop Habibb","total_price":1350,"booking_amount":0,"amount_to_be_paid":1350,"service_amount":null,"date":"23-10-2021","createdOn":{"$date":"2021-10-23T15:23:57Z"},"products":[],"services":[{"service_name":"Global Hair Colour L'Oréal","service_id":"t9VqHbinQ","quantity":1,"employee_id":"yPknaFt9A","employee_name":"Asish Sarkar","total":1100,"_id":{"$oid":"6174290d3d69ac0017df477a"}},{"service_name":"Haircut","service_id":"_lgiV_EF6","quantity":1,"employee_id":"yPknaFt9A","employee_name":"Asish Sarkar","total":250,"_id":{"$oid":"6174290d3d69ac0017df477b"}}],"__v":0}
{"_id":{"$oid":"6174299d3d69ac0017df47a3"},"bill_id":"CH--zmMOer4S","user_name":"Dunlop  POS 1","user_id":"GXj8dQsbD","customer_name":"s samader","customer_phone":8.443044261E+09,"customer_alternative_phone":null,"customer_address":"","payment_mode":"Card Paytm SD","branch_id":"gW0vfq11U","branch_name":"Dunlop Habibb","total_price":1000,"booking_amount":0,"amount_to_be_paid":1000,"service_amount":null,"date":"23-10-2021","createdOn":{"$date":"2021-10-23T15:26:21Z"},"products":[],"services":[{"service_name":"Anti Dandruff Treatment L'oréal","service_id":"PeUUnLrh9","quantity":1,"employee_id":"HzsHZvits","employee_name":"Ram Parvesh Thakur","total":1000,"_id":{"$oid":"6174299d3d69ac0017df47a4"}}],"__v":0}
{"_id":{"$oid":"61742a2b3d69ac0017df47c2"},"bill_id":"CH-zz6dgzGnh","user_name":"Dunlop  POS 1","user_id":"GXj8dQsbD","customer_name":"a neyogi","customer_phone":9.038566053E+09,"customer_alternative_phone":null,"customer_address":"","payment_mode":"Cash","branch_id":"gW0vfq11U","branch_name":"Dunlop Habibb","total_price":450,"booking_amount":0,"amount_to_be_paid":450,"service_amount":null,"date":"23-10-2021","createdOn":{"$date":"2021-10-23T15:28:43Z"},"products":[],"services":[{"service_name":"Haircut","service_id":"_lgiV_EF6","quantity":1,"employee_id":"yPknaFt9A","employee_name":"Asish Sarkar","total":450,"_id":{"$oid":"61742a2b3d69ac0017df47c3"}},{"service_name":"Threading","service_id":"ud7ij2ML2","quantity":1,"employee_id":null,"employee_name":"","total":30,"_id":{"$oid":"61742a2b3d69ac0017df47c4"}}],"__v":0}
{"_id":{"$oid":"61742ab53d69ac0017df47e3"},"bill_id":"CH-4qL4hOysE","user_name":"Dunlop  POS 1","user_id":"GXj8dQsbD","customer_name":"","customer_phone":9.007634931E+09,"customer_alternative_phone":null,"customer_address":"","payment_mode":"Card Paytm ET","branch_id":"gW0vfq11U","branch_name":"Dunlop Habibb","total_price":900,"booking_amount":0,"amount_to_be_paid":900,"service_amount":null,"date":"23-10-2021","createdOn":{"$date":"2021-10-23T15:31:01Z"},"products":[{"product_name":"Peptide Repair Rescue Shampoo","product_id":"rX3SeGA3s","quantity":1,"employee_id":null,"employee_name":"","total":900,"_id":{"$oid":"61742ab53d69ac0017df47e4"}}],"services":[],"__v":0}
{"_id":{"$oid":"61742bef3d69ac0017df4800"},"bill_id":"CH-nNPwpk5by","user_name":"Dunlop  POS 1","user_id":"GXj8dQsbD","customer_name":"","customer_phone":9.831663263E+09,"customer_alternative_phone":null,"customer_address":"","payment_mode":"Card Paytm SD","branch_id":"gW0vfq11U","branch_name":"Dunlop Habibb","total_price":1330,"booking_amount":0,"amount_to_be_paid":1330,"service_amount":null,"date":"23-10-2021","createdOn":{"$date":"2021-10-23T15:36:15Z"},"products":[{"product_name":"B6 Biotin Shampoo","product_id":"1Z1Ntv07D","quantity":1,"employee_id":"gRo3RP5_J","employee_name":"Mukti Mohanty","total":665,"_id":{"$oid":"61742bef3d69ac0017df4801"}},{"product_name":"Vitamino Colour Shampoo","product_id":"GhofBCFI4","quantity":1,"employee_id":"gRo3RP5_J","employee_name":"Mukti Mohanty","total":665,"_id":{"$oid":"61742bef3d69ac0017df4802"}}],"services":[],"__v":0}
{"_id":{"$oid":"61742ce83d69ac0017df481f"},"bill_id":"CH-9F4ZCMMts","user_name":"Dunlop  POS 1","user_id":"GXj8dQsbD","customer_name":"aparna barmam","customer_phone":9.903219366E+09,"customer_alternative_phone":null,"customer_address":"","payment_mode":"Cash","branch_id":"gW0vfq11U","branch_name":"Dunlop Habibb","total_price":30,"booking_amount":0,"amount_to_be_paid":30,"service_amount":null,"date":"23-10-2021","createdOn":{"$date":"2021-10-23T15:40:24Z"},"products":[],"services":[{"service_name":"Threading","service_id":"ud7ij2ML2","quantity":1,"employee_id":"QnLkgjb5T","employee_name":"Minakshi Giri","total":30,"_id":{"$oid":"61742ce83d69ac0017df4820"}}],"__v":0}
{"_id":{"$oid":"6175335b108052001757a2d3"},"bill_id":"CH-BBZHfug4x","user_name":"Rakesh Nandi","user_id":"n-VwGbpDb","customer_name":"suman maity","customer_phone":7.866906718E+09,"customer_alternative_phone":null,"customer_address":"","payment_mode":"Cash","branch_id":"fVj4BG0fF","branch_name":"Airport Habibb","total_price":300,"booking_amount":0,"amount_to_be_paid":300,"service_amount":null,"date":"24-10-2021","createdOn":{"$date":"2021-10-24T10:20:11Z"},"products":[],"services":[{"service_name":"Haircut","service_id":"_lgiV_EF6","quantity":1,"employee_id":"ZpqL1hGGA","employee_name":"Om Kumar Gupta","total":300,"_id":{"$oid":"6175335b108052001757a2d4"}}],"__v":0}
{"_id":{"$oid":"617550303090d7001777b6d2"},"bill_id":"CH-vPcv_gXpI","user_name":"Rakesh Nandi","user_id":"n-VwGbpDb","customer_name":"simran","customer_phone":7.258001256E+09,"customer_alternative_phone":null,"customer_address":"","payment_mode":"GPay","branch_id":"fVj4BG0fF","branch_name":"Airport Habibb","total_price":60,"booking_amount":0,"amount_to_be_paid":60,"service_amount":null,"date":"24-10-2021","createdOn":{"$date":"2021-10-24T12:23:12Z"},"products":[],"services":[{"service_name":"Threading","service_id":"ud7ij2ML2","quantity":1,"employee_id":"4FWSIRRQ1","employee_name":"Chanda Choudhary","total":30,"_id":{"$oid":"617550303090d7001777b6d3"}},{"service_name":"Threading","service_id":"ud7ij2ML2","quantity":1,"employee_id":"xoL9X1f8W","employee_name":"Rajeshwari Singha(rimi)","total":30,"_id":{"$oid":"617550303090d7001777b6d4"}}],"__v":0}
{"_id":{"$oid":"617580d7a8230d0017950bde"},"bill_id":"CH-AAcqFJ9bp","user_name":"Rakesh Nandi","user_id":"n-VwGbpDb","customer_name":"swapna halder","customer_phone":8.910988711E+09,"customer_alternative_phone":null,"customer_address":"","payment_mode":"Cash","branch_id":"fVj4BG0fF","branch_name":"Airport Habibb","total_price":7000,"booking_amount":0,"amount_to_be_paid":7000,"service_amount":null,"date":"24-10-2021","createdOn":{"$date":"2021-10-24T15:50:47Z"},"products":[],"services":[{"service_name":"Keratin Treatment","service_id":"eUB8NECWm","quantity":1,"employee_id":"ZpqL1hGGA","employee_name":"Om Kumar Gupta","total":7000,"_id":{"$oid":"617580d7a8230d0017950bdf"}}],"__v":0}
{"_id":{"$oid":"617711a5f3c7730017a63127"},"bill_id":"CH-gxUbNHGR9","user_name":"Daksh singh6","user_id":"qxRjICgll","customer_name":"ankit","customer_phone":8.777383451E+09,"customer_alternative_phone":null,"customer_address":"","payment_mode":"Cash","branch_id":"KOhOskJLG","branch_name":"Dunlop Habibb","total_price":500,"booking_amount":0,"amount_to_be_paid":500,"service_amount":null,"date":"26-10-2021","createdOn":{"$date":"2021-10-25T20:20:53Z"},"products":[],"services":[{"service_name":"Haircut","service_id":"_lgiV_EF6","quantity":1,"employee_id":"HSSbtC8oe","employee_name":"Abhishek Sharma","total":500,"_id":{"$oid":"617711a5f3c7730017a63128"}}],"__v":0}
{"_id":{"$oid":"617712f0f3c7730017a63172"},"bill_id":"CH-qE7ytvDQB","user_name":"Daksh singh6","user_id":"qxRjICgll","customer_name":"","customer_phone":null,"customer_alternative_phone":null,"customer_address":"","payment_mode":"Cash","branch_id":"KOhOskJLG","branch_name":"Dunlop Habibb","total_price":2500,"booking_amount":0,"amount_to_be_paid":2500,"service_amount":null,"date":"26-10-2021","createdOn":{"$date":"2021-10-25T20:26:24Z"},"products":[{"product_name":"Absolut Repair Shampoo","product_id":"8ABu6lSSP","quantity":1,"employee_id":"X4rvp4rOl","employee_name":"Aniket Singh","total":700,"_id":{"$oid":"617712f0f3c7730017a63173"}},{"product_name":"Absolut Repair Oil","product_id":"lKtLcUIPu","quantity":1,"employee_id":"yPknaFt9A","employee_name":"Asish Sarkar","total":500,"_id":{"$oid":"617712f0f3c7730017a63174"}},{"product_name":"Liss Unlimited Serum","product_id":"6N5vRflS9","quantity":1,"employee_id":"ZhDco8XLt","employee_name":"Aisha Khatoon","total":600,"_id":{"$oid":"617712f0f3c7730017a63175"}}],"services":[{"service_name":"Haircut","service_id":"_lgiV_EF6","quantity":1,"employee_id":"HSSbtC8oe","employee_name":"Abhishek Sharma","total":700,"_id":{"$oid":"617712f0f3c7730017a63176"}}],"__v":0}
{"_id":{"$oid":"6177ba5b558c5d0017d7b255"},"bill_id":"CH-N56KegcJz","user_name":"Rakesh Nandi","user_id":"n-VwGbpDb","customer_name":"s paul","customer_phone":9.830736051E+09,"customer_alternative_phone":null,"customer_address":"","payment_mode":"Cash","branch_id":"fVj4BG0fF","branch_name":"Airport Habibb","total_price":400,"booking_amount":0,"amount_to_be_paid":400,"service_amount":null,"date":"26-10-2021","createdOn":{"$date":"2021-10-26T08:20:43Z"},"products":[],"services":[{"service_name":"Haircut","service_id":"_lgiV_EF6","quantity":1,"employee_id":"saUwR7UER","employee_name":"Nirmal Karan","total":400,"_id":{"$oid":"6177ba5b558c5d0017d7b256"}}],"__v":0}
{"_id":{"$oid":"6177d139a47824001782e41e"},"bill_id":"CH-K-A7o09i9","user_name":"Rakesh Nandi","user_id":"n-VwGbpDb","customer_name":"puspa","customer_phone":9.33060235E+09,"customer_alternative_phone":null,"customer_address":"","payment_mode":"Cash","branch_id":"fVj4BG0fF","branch_name":"Airport Habibb","total_price":850,"booking_amount":0,"amount_to_be_paid":850,"service_amount":null,"date":"26-10-2021","createdOn":{"$date":"2021-10-26T09:58:17Z"},"products":[],"services":[{"service_name":"Haircut","service_id":"_lgiV_EF6","quantity":1,"employee_id":"ZpqL1hGGA","employee_name":"Om Kumar Gupta","total":500,"_id":{"$oid":"6177d139a47824001782e41f"}},{"service_name":"Threading","service_id":"ud7ij2ML2","quantity":1,"employee_id":"4FWSIRRQ1","employee_name":"Chanda Choudhary","total":50,"_id":{"$oid":"6177d139a47824001782e420"}},{"service_name":"Waxing Rica Full Face","service_id":"CRhEx9cwu","quantity":1,"employee_id":"4FWSIRRQ1","employee_name":"Chanda Choudhary","total":300,"_id":{"$oid":"6177d139a47824001782e421"}}],"__v":0}
{"_id":{"$oid":"6177f0907293b600170addcc"},"bill_id":"CH-c0pyx9m5l","user_name":"Rakesh Nandi","user_id":"n-VwGbpDb","customer_name":"p dutta","customer_phone":7.998388505E+09,"customer_alternative_phone":null,"customer_address":"","payment_mode":"Cash","branch_id":"fVj4BG0fF","branch_name":"Airport Habibb","total_price":1800,"booking_amount":0,"amount_to_be_paid":1800,"service_amount":null,"date":"26-10-2021","createdOn":{"$date":"2021-10-26T12:12:00Z"},"products":[],"services":[{"service_name":"Threading","service_id":"ud7ij2ML2","quantity":1,"employee_id":"4FWSIRRQ1","employee_name":"Chanda Choudhary","total":100,"_id":{"$oid":"6177f0907293b600170addcd"}},{"service_name":"Facial Lotus","service_id":"p87TjYN8q","quantity":1,"employee_id":"4FWSIRRQ1","employee_name":"Chanda Choudhary","total":1700,"_id":{"$oid":"6177f0907293b600170addce"}}],"__v":0}
{"_id":{"$oid":"617804e7835fb400177967d6"},"bill_id":"CH-JX70DbnQt","user_name":"Rakesh Nandi","user_id":"n-VwGbpDb","customer_name":"s gomes","customer_phone":9.831431346E+09,"customer_alternative_phone":null,"customer_address":"","payment_mode":"Card Paytm SD","branch_id":"fVj4BG0fF","branch_name":"Airport Habibb","total_price":1500,"booking_amount":0,"amount_to_be_paid":1500,"service_amount":null,"date":"26-10-2021","createdOn":{"$date":"2021-10-26T13:38:47Z"},"products":[],"services":[{"service_name":"Root Touch-Up L'oréal","service_id":"-9eBiUT52","quantity":1,"employee_id":"saUwR7UER","employee_name":"Nirmal Karan","total":1500,"_id":{"$oid":"617804e7835fb400177967d7"}}],"__v":0}
{"_id":{"$oid":"61780ca8835fb400177967e9"},"bill_id":"CH-RI7rBT1s2","user_name":"Rakesh Nandi","user_id":"n-VwGbpDb","customer_name":"s roy","customer_phone":9.883127273E+09,"customer_alternative_phone":null,"customer_address":"","payment_mode":"Cash","branch_id":"fVj4BG0fF","branch_name":"Airport Habibb","total_price":50,"booking_amount":0,"amount_to_be_paid":50,"service_amount":null,"date":"26-10-2021","createdOn":{"$date":"2021-10-26T14:11:52Z"},"products":[],"services":[{"service_name":"Threading","service_id":"ud7ij2ML2","quantity":1,"employee_id":"4FWSIRRQ1","employee_name":"Chanda Choudhary","total":50,"_id":{"$oid":"61780ca8835fb400177967ea"}}],"__v":0}
{"_id":{"$oid":"6178168986e71100178656b9"},"bill_id":"CH-szXB9yH-S","user_name":"Rakesh Nandi","user_id":"n-VwGbpDb","customer_name":"trishanu mondal","customer_phone":8.910939443E+09,"customer_alternative_phone":null,"customer_address":"","payment_mode":"Cash","branch_id":"fVj4BG0fF","branch_name":"Airport Habibb","total_price":1200,"booking_amount":0,"amount_to_be_paid":1200,"service_amount":null,"date":"26-10-2021","createdOn":{"$date":"2021-10-26T14:54:01Z"},"products":[],"services":[{"service_name":"Hair Spa L'Oréal","service_id":"5VY3R4CTl","quantity":1,"employee_id":"ZpqL1hGGA","employee_name":"Om Kumar Gupta","total":1200,"_id":{"$oid":"6178168986e71100178656ba"}}],"__v":0}
{"_id":{"$oid":"617b96b7e50b930017579bb9"},"bill_id":"CH-kn076-Kc3","user_name":"Dunlop  POS 1","user_id":"GXj8dQsbD","customer_name":"lisha roy","customer_phone":8.917678782E+09,"customer_alternative_phone":null,"customer_address":"","payment_mode":"Cash","branch_id":"gW0vfq11U","branch_name":"Dunlop Habibb","total_price":50,"booking_amount":0,"amount_to_be_paid":50,"service_amount":null,"date":"29-10-2021","createdOn":{"$date":"2021-10-29T06:37:43Z"},"products":[],"services":[{"service_name":"Threading","service_id":"ud7ij2ML2","quantity":1,"employee_id":"GhAk7n-Kj","employee_name":"Shruti  Agarwal","total":50,"_id":{"$oid":"617b96b7e50b930017579bba"}}],"__v":0}
{"_id":{"$oid":"617b995ae50b930017579bd7"},"bill_id":"CH-cbgEqh0HJ","user_name":"Rakesh Nandi","user_id":"n-VwGbpDb","customer_name":"priya das","customer_phone":9.007459174E+09,"customer_alternative_phone":null,"customer_address":"","payment_mode":"Cash","branch_id":"fVj4BG0fF","branch_name":"Airport Habibb","total_price":90,"booking_amount":0,"amount_to_be_paid":90,"service_amount":null,"date":"29-10-2021","createdOn":{"$date":"2021-10-29T06:48:58Z"},"products":[],"services":[{"service_name":"Threading","service_id":"ud7ij2ML2","quantity":1,"employee_id":"4FWSIRRQ1","employee_name":"Chanda Choudhary","total":90,"_id":{"$oid":"617b995ae50b930017579bd8"}}],"__v":0}
{"_id":{"$oid":"617ba595e50b930017579c03"},"bill_id":"CH-_OpkY4kEN","user_name":"Rakesh Nandi","user_id":"n-VwGbpDb","customer_name":"n shaw","customer_phone":8.013869696E+09,"customer_alternative_phone":null,"customer_address":"","payment_mode":"Cash","branch_id":"fVj4BG0fF","branch_name":"Airport Habibb","total_price":300,"booking_amount":0,"amount_to_be_paid":300,"service_amount":null,"date":"29-10-2021","createdOn":{"$date":"2021-10-29T07:41:09Z"},"products":[],"services":[{"service_name":"Haircut","service_id":"_lgiV_EF6","quantity":1,"employee_id":"ZpqL1hGGA","employee_name":"Om Kumar Gupta","total":300,"_id":{"$oid":"617ba595e50b930017579c04"}}],"__v":0}
{"_id":{"$oid":"617bb3488c7d1b001700b44c"},"bill_id":"CH-zL8t5pRbD","user_name":"Rakesh Nandi","user_id":"n-VwGbpDb","customer_name":"liza mallick","customer_phone":9.804418816E+09,"customer_alternative_phone":null,"customer_address":"","payment_mode":"Card","branch_id":"fVj4BG0fF","branch_name":"Airport Habibb","total_price":1270,"booking_amount":0,"amount_to_be_paid":1270,"service_amount":null,"date":"29-10-2021","createdOn":{"$date":"2021-10-29T08:39:36Z"},"products":[],"services":[{"service_name":"Hair Spa L'Oréal","service_id":"5VY3R4CTl","quantity":1,"employee_id":"saUwR7UER","employee_name":"Nirmal Karan","total":1200,"_id":{"$oid":"617bb3488c7d1b001700b44d"}},{"service_name":"Threading","service_id":"ud7ij2ML2","quantity":1,"employee_id":"4FWSIRRQ1","employee_name":"Chanda Choudhary","total":70,"_id":{"$oid":"617bb3488c7d1b001700b44e"}}],"__v":0}
{"_id":{"$oid":"617bb4fa8c7d1b001700b480"},"bill_id":"CH-apTjSHfew","user_name":"Rakesh Nandi","user_id":"n-VwGbpDb","customer_name":"soma das","customer_phone":8.583042879E+09,"customer_alternative_phone":null,"customer_address":"","payment_mode":"Cash","branch_id":"fVj4BG0fF","branch_name":"Airport Habibb","total_price":550,"booking_amount":0,"amount_to_be_paid":550,"service_amount":null,"date":"29-10-2021","createdOn":{"$date":"2021-10-29T08:46:50Z"},"products":[],"services":[{"service_name":"Threading","service_id":"ud7ij2ML2","quantity":1,"employee_id":"4FWSIRRQ1","employee_name":"Chanda Choudhary","total":50,"_id":{"$oid":"617bb4fa8c7d1b001700b481"}},{"service_name":"Ozone Treatment","service_id":"SIfNjB-5W","quantity":1,"employee_id":"saUwR7UER","employee_name":"Nirmal Karan","total":500,"_id":{"$oid":"617bb4fa8c7d1b001700b482"}}],"__v":0}
{"_id":{"$oid":"617bb6018c7d1b001700b491"},"bill_id":"CH-dJ6sqLUuy","user_name":"Rakesh Nandi","user_id":"n-VwGbpDb","customer_name":"soma das","customer_phone":8.583042879E+09,"customer_alternative_phone":null,"customer_address":"","payment_mode":"Cash","branch_id":"fVj4BG0fF","branch_name":"Airport Habibb","total_price":3230,"booking_amount":0,"amount_to_be_paid":3230,"service_amount":null,"date":"29-10-2021","createdOn":{"$date":"2021-10-29T08:51:13Z"},"products":[{"product_name":"Peptide Repair Rescue Shampoo","product_id":"rX3SeGA3s","quantity":1,"employee_id":null,"employee_name":"","total":855,"_id":{"$oid":"617bb6018c7d1b001700b492"}},{"product_name":"Peptide Repair Rescue Treatment","product_id":"-CVWu_FxD","quantity":1,"employee_id":null,"employee_name":"","total":950,"_id":{"$oid":"617bb6018c7d1b001700b493"}},{"product_name":"N3 Wella Plex","product_id":"SKO76bZE6","quantity":1,"employee_id":"saUwR7UER","employee_name":"Nirmal Karan","total":1425,"_id":{"$oid":"617bb6018c7d1b001700b494"}}],"services":[],"__v":0}
{"_id":{"$oid":"617bb79c8c7d1b001700b4bd"},"bill_id":"CH-z2yLvCRj_","user_name":"Rakesh Nandi","user_id":"n-VwGbpDb","customer_name":"madhumita","customer_phone":9.433361731E+09,"customer_alternative_phone":null,"customer_address":"","payment_mode":"Card Paytm SD","branch_id":"fVj4BG0fF","branch_name":"Airport Habibb","total_price":1000,"booking_amount":0,"amount_to_be_paid":1000,"service_amount":null,"date":"29-10-2021","createdOn":{"$date":"2021-10-29T08:58:04Z"},"products":[{"product_name":"Peptide Repair Rescue Treatment","product_id":"-CVWu_FxD","quantity":1,"employee_id":"saUwR7UER","employee_name":"Nirmal Karan","total":1000,"_id":{"$oid":"617bb79c8c7d1b001700b4be"}}],"services":[],"__v":0}
{"_id":{"$oid":"617bbe828c7d1b001700b4d0"},"bill_id":"CH-Mm_cJq4BS","user_name":"Rakesh Nandi","user_id":"n-VwGbpDb","customer_name":"ankita chowdhury","customer_phone":9.883827332E+09,"customer_alternative_phone":null,"customer_address":"","payment_mode":"Cash","branch_id":"fVj4BG0fF","branch_name":"Airport Habibb","total_price":50,"booking_amount":0,"amount_to_be_paid":50,"service_amount":null,"date":"29-10-2021","createdOn":{"$date":"2021-10-29T09:27:30Z"},"products":[],"services":[{"service_name":"Threading","service_id":"ud7ij2ML2","quantity":1,"employee_id":"4FWSIRRQ1","employee_name":"Chanda Choudhary","total":50,"_id":{"$oid":"617bbe828c7d1b001700b4d1"}}],"__v":0}
{"_id":{"$oid":"617bc0a38c7d1b001700b4e5"},"bill_id":"CH-IsnpEinSq","user_name":"Rakesh Nandi","user_id":"n-VwGbpDb","customer_name":"abir das","customer_phone":6.291231356E+09,"customer_alternative_phone":null,"customer_address":"","payment_mode":"Card Paytm SD","branch_id":"fVj4BG0fF","branch_name":"Airport Habibb","total_price":400,"booking_amount":0,"amount_to_be_paid":400,"service_amount":null,"date":"29-10-2021","createdOn":{"$date":"2021-10-29T09:36:35Z"},"products":[],"services":[{"service_name":"Haircut","service_id":"_lgiV_EF6","quantity":1,"employee_id":"ZpqL1hGGA","employee_name":"Om Kumar Gupta","total":300,"_id":{"$oid":"617bc0a38c7d1b001700b4e6"}},{"service_name":"Beard Trimming/ Sculpting/ Clean Shave","service_id":"za2ayR7-c","quantity":1,"employee_id":"ZpqL1hGGA","employee_name":"Om Kumar Gupta","total":100,"_id":{"$oid":"617bc0a38c7d1b001700b4e7"}}],"__v":0}
{"_id":{"$oid":"617bee6391a6110017e2665d"},"bill_id":"CH-Dn2sDmfZm","user_name":"Rakesh Nandi","user_id":"n-VwGbpDb","customer_name":"n das","customer_phone":9.007187552E+09,"customer_alternative_phone":null,"customer_address":"","payment_mode":"Cash","branch_id":"fVj4BG0fF","branch_name":"Airport Habibb","total_price":250,"booking_amount":0,"amount_to_be_paid":250,"service_amount":null,"date":"29-10-2021","createdOn":{"$date":"2021-10-29T12:51:47Z"},"products":[],"services":[{"service_name":"Shampoo Blowdry L'oréal","service_id":"9UZwaWDAp","quantity":1,"employee_id":"4FWSIRRQ1","employee_name":"Chanda Choudhary","total":250,"_id":{"$oid":"617bee6391a6110017e2665e"}}],"__v":0}
{"_id":{"$oid":"617bf8f389e7da0017bdc32c"},"bill_id":"CH-xhufnLj4m","user_name":"Rakesh Nandi","user_id":"n-VwGbpDb","customer_name":"manisha biswas","customer_phone":8.274035221E+09,"customer_alternative_phone":null,"customer_address":"","payment_mode":"GPay","branch_id":"fVj4BG0fF","branch_name":"Airport Habibb","total_price":540,"booking_amount":0,"amount_to_be_paid":540,"service_amount":null,"date":"29-10-2021","createdOn":{"$date":"2021-10-29T13:36:51Z"},"products":[],"services":[{"service_name":"Threading","service_id":"ud7ij2ML2","quantity":1,"employee_id":"dmjjffkK0","employee_name":"Rakesh Nandi","total":40,"_id":{"$oid":"617bf8f389e7da0017bdc32d"}},{"service_name":"Haircut","service_id":"_lgiV_EF6","quantity":1,"employee_id":"ZpqL1hGGA","employee_name":"Om Kumar Gupta","total":500,"_id":{"$oid":"617bf8f389e7da0017bdc32e"}}],"__v":0}
{"_id":{"$oid":"617c08309e77380017d38a71"},"bill_id":"CH-CHlb-xU9s","user_name":"Rakesh Nandi","user_id":"n-VwGbpDb","customer_name":"susma","customer_phone":9.830231541E+09,"customer_alternative_phone":null,"customer_address":"","payment_mode":"Card Paytm SD","branch_id":"fVj4BG0fF","branch_name":"Airport Habibb","total_price":640,"booking_amount":0,"amount_to_be_paid":640,"service_amount":null,"date":"29-10-2021","createdOn":{"$date":"2021-10-29T14:41:52Z"},"products":[],"services":[{"service_name":"Haircut","service_id":"_lgiV_EF6","quantity":1,"employee_id":"saUwR7UER","employee_name":"Nirmal Karan","total":500,"_id":{"$oid":"617c08309e77380017d38a72"}},{"service_name":"Threading","service_id":"ud7ij2ML2","quantity":1,"employee_id":"4FWSIRRQ1","employee_name":"Chanda Choudhary","total":140,"_id":{"$oid":"617c08309e77380017d38a73"}}],"__v":0}
{"_id":{"$oid":"617c0b639e77380017d38aae"},"bill_id":"CH-m9VedGONJ","user_name":"Rakesh Nandi","user_id":"n-VwGbpDb","customer_name":"neha pradhan","customer_phone":9.831157962E+09,"customer_alternative_phone":null,"customer_address":"","payment_mode":"Card Paytm SD","branch_id":"fVj4BG0fF","branch_name":"Airport Habibb","total_price":1100,"booking_amount":0,"amount_to_be_paid":1100,"service_amount":null,"date":"29-10-2021","createdOn":{"$date":"2021-10-29T14:55:31Z"},"products":[],"services":[{"service_name":"Waxing Rica Legs Full ","service_id":"AeexpRRFd","quantity":1,"employee_id":"4FWSIRRQ1","employee_name":"Chanda Choudhary","total":700,"_id":{"$oid":"617c0b639e77380017d38aaf"}},{"service_name":"Waxing Rica Hands Full","service_id":"cMjpBGCuP","quantity":1,"employee_id":"4FWSIRRQ1","employee_name":"Chanda Choudhary","total":400,"_id":{"$oid":"617c0b639e77380017d38ab0"}}],"__v":0}
{"_id":{"$oid":"617c0be29e77380017d38abc"},"bill_id":"CH-o5NjMK9rw","user_name":"Rakesh Nandi","user_id":"n-VwGbpDb","customer_name":"neha pradhan","customer_phone":9.831157962E+09,"customer_alternative_phone":null,"customer_address":"","payment_mode":"Card Paytm SD","branch_id":"fVj4BG0fF","branch_name":"Airport Habibb","total_price":100,"booking_amount":0,"amount_to_be_paid":100,"service_amount":null,"date":"29-10-2021","createdOn":{"$date":"2021-10-29T14:57:38Z"},"products":[],"services":[{"service_name":"Waxing Normal Underarms","service_id":"pu4QBVQGF","quantity":1,"employee_id":"4FWSIRRQ1","employee_name":"Chanda Choudhary","total":100,"_id":{"$oid":"617c0be29e77380017d38abd"}}],"__v":0}
{"_id":{"$oid":"617c10259e77380017d38ad0"},"bill_id":"CH-PoxITRzfq","user_name":"Rakesh Nandi","user_id":"n-VwGbpDb","customer_name":"subhamita roy","customer_phone":9.474795449E+09,"customer_alternative_phone":null,"customer_address":"","payment_mode":"Card Paytm SD","branch_id":"fVj4BG0fF","branch_name":"Airport Habibb","total_price":350,"booking_amount":0,"amount_to_be_paid":350,"service_amount":null,"date":"29-10-2021","createdOn":{"$date":"2021-10-29T15:15:49Z"},"products":[],"services":[{"service_name":"Shampoo Blowdry L'oréal","service_id":"9UZwaWDAp","quantity":1,"employee_id":"ZpqL1hGGA","employee_name":"Om Kumar Gupta","total":350,"_id":{"$oid":"617c10259e77380017d38ad1"}}],"__v":0}
{"_id":{"$oid":"617ce72537eff10017455a87"},"bill_id":"CH-XsA6bYu7r","user_name":"Dunlop  POS 1","user_id":"GXj8dQsbD","customer_name":"s pal","customer_phone":6.290303277E+09,"customer_alternative_phone":null,"customer_address":"","payment_mode":"Cash","branch_id":"gW0vfq11U","branch_name":"Dunlop Habibb","total_price":50,"booking_amount":0,"amount_to_be_paid":50,"service_amount":null,"date":"30-10-2021","createdOn":{"$date":"2021-10-30T06:33:09Z"},"products":[],"services":[{"service_name":"Threading","service_id":"ud7ij2ML2","quantity":1,"employee_id":"GhAk7n-Kj","employee_name":"Shruti  Agarwal","total":50,"_id":{"$oid":"617ce72537eff10017455a88"}}],"__v":0}
{"_id":{"$oid":"617cebbb37eff10017455aa4"},"bill_id":"CH-gTGF0s9Qw","user_name":"Dunlop  POS 1","user_id":"GXj8dQsbD","customer_name":"a maitra","customer_phone":9.830221008E+09,"customer_alternative_phone":null,"customer_address":"","payment_mode":"Cash","branch_id":"gW0vfq11U","branch_name":"Dunlop Habibb","total_price":50,"booking_amount":0,"amount_to_be_paid":50,"service_amount":null,"date":"30-10-2021","createdOn":{"$date":"2021-10-30T06:52:43Z"},"products":[],"services":[{"service_name":"Threading","service_id":"ud7ij2ML2","quantity":1,"employee_id":"QnLkgjb5T","employee_name":"Minakshi Giri","total":50,"_id":{"$oid":"617cebbb37eff10017455aa5"}}],"__v":0}
{"_id":{"$oid":"617cf18b37eff10017455acb"},"bill_id":"CH-7khctEYVj","user_name":"Rakesh Nandi","user_id":"n-VwGbpDb","customer_name":"subhankar bhowmik","customer_phone":8.420305037E+09,"customer_alternative_phone":null,"customer_address":"","payment_mode":"Card Paytm SD","branch_id":"fVj4BG0fF","branch_name":"Airport Habibb","total_price":300,"booking_amount":0,"amount_to_be_paid":300,"service_amount":null,"date":"30-10-2021","createdOn":{"$date":"2021-10-30T07:17:31Z"},"products":[],"services":[{"service_name":"Haircut","service_id":"_lgiV_EF6","quantity":1,"employee_id":"ZpqL1hGGA","employee_name":"Om Kumar Gupta","total":300,"_id":{"$oid":"617cf18b37eff10017455acc"}}],"__v":0}
{"_id":{"$oid":"617cf6aa37eff10017455ade"},"bill_id":"CH-a9vp8TB4X","user_name":"Dunlop  POS 1","user_id":"GXj8dQsbD","customer_name":"susmita pal","customer_phone":9.87429628E+09,"customer_alternative_phone":null,"customer_address":"","payment_mode":"Cash","branch_id":"gW0vfq11U","branch_name":"Dunlop Habibb","total_price":500,"booking_amount":0,"amount_to_be_paid":500,"service_amount":null,"date":"30-10-2021","createdOn":{"$date":"2021-10-30T07:39:22Z"},"products":[],"services":[{"service_name":"Haircut","service_id":"_lgiV_EF6","quantity":1,"employee_id":"yPknaFt9A","employee_name":"Asish Sarkar","total":500,"_id":{"$oid":"617cf6aa37eff10017455adf"}}],"__v":0}
{"_id":{"$oid":"617cfc0e37eff10017455b34"},"bill_id":"CH-VP1AdRQLR","user_name":"Dunlop  POS 1","user_id":"GXj8dQsbD","customer_name":"shanghamitra dey","customer_phone":9.051966988E+09,"customer_alternative_phone":null,"customer_address":"","payment_mode":"Card Paytm SD","branch_id":"gW0vfq11U","branch_name":"Dunlop Habibb","total_price":530,"booking_amount":0,"amount_to_be_paid":530,"service_amount":null,"date":"30-10-2021","createdOn":{"$date":"2021-10-30T08:02:22Z"},"products":[],"services":[{"service_name":"Threading","service_id":"ud7ij2ML2","quantity":1,"employee_id":"GhAk7n-Kj","employee_name":"Shruti  Agarwal","total":30,"_id":{"$oid":"617cfc0e37eff10017455b35"}},{"service_name":"Facial Lotus","service_id":"p87TjYN8q","quantity":1,"employee_id":"GhAk7n-Kj","employee_name":"Shruti  Agarwal","total":500,"_id":{"$oid":"617cfc0e37eff10017455b36"}}],"__v":0}
{"_id":{"$oid":"617cfce537eff10017455b58"},"bill_id":"CH-TRaGZ9A9g","user_name":"Dunlop  POS 1","user_id":"GXj8dQsbD","customer_name":"debojyoti paul","customer_phone":9.0087910638E+10,"customer_alternative_phone":null,"customer_address":"","payment_mode":"Cash","branch_id":"gW0vfq11U","branch_name":"Dunlop Habibb","total_price":1150,"booking_amount":0,"amount_to_be_paid":1150,"service_amount":null,"date":"30-10-2021","createdOn":{"$date":"2021-10-30T08:05:57Z"},"products":[],"services":[{"service_name":"Facial Lotus","service_id":"p87TjYN8q","quantity":1,"employee_id":"QnLkgjb5T","employee_name":"Minakshi Giri","total":800,"_id":{"$oid":"617cfce537eff10017455b59"}},{"service_name":"Haircut","service_id":"_lgiV_EF6","quantity":1,"employee_id":"yPknaFt9A","employee_name":"Asish Sarkar","total":250,"_id":{"$oid":"617cfce537eff10017455b5a"}},{"service_name":"Beard Trimming/ Sculpting/ Clean Shave","service_id":"za2ayR7-c","quantity":1,"employee_id":"yPknaFt9A","employee_name":"Asish Sarkar","total":100,"_id":{"$oid":"617cfce537eff10017455b5b"}}],"__v":0}
{"_id":{"$oid":"617d003337eff10017455b81"},"bill_id":"CH-HI8t5Y-sb","user_name":"Dunlop  POS 1","user_id":"GXj8dQsbD","customer_name":"s paul","customer_phone":9.874438663E+09,"customer_alternative_phone":null,"customer_address":"","payment_mode":"Cash","branch_id":"gW0vfq11U","branch_name":"Dunlop Habibb","total_price":530,"booking_amount":0,"amount_to_be_paid":530,"service_amount":null,"date":"30-10-2021","createdOn":{"$date":"2021-10-30T08:20:03Z"},"products":[],"services":[{"service_name":"Threading","service_id":"ud7ij2ML2","quantity":1,"employee_id":"wOOO9yvm9","employee_name":"Vandana Hela","total":30,"_id":{"$oid":"617d003337eff10017455b82"}},{"service_name":"Waxing Brazilian Full Face","service_id":"-F4k_7r2P","quantity":1,"employee_id":"Az8kgfy5i","employee_name":"Gulshan Bano","total":500,"_id":{"$oid":"617d003337eff10017455b83"}}],"__v":0}
{"_id":{"$oid":"617d07e737eff10017455be0"},"bill_id":"CH-IR_-pK8pi","user_name":"Dunlop  POS 1","user_id":"GXj8dQsbD","customer_name":"payel chakraborty","customer_phone":9.051124446E+09,"customer_alternative_phone":6.289506622E+09,"customer_address":"","payment_mode":"Card Paytm SD","branch_id":"gW0vfq11U","branch_name":"Dunlop Habibb","total_price":1580,"booking_amount":0,"amount_to_be_paid":1580,"service_amount":null,"date":"30-10-2021","createdOn":{"$date":"2021-10-30T08:52:55Z"},"products":[],"services":[{"service_name":"Hair Spa Schwarzkopf","service_id":"MW0Zdm6Fm","quantity":1,"employee_id":"3vzoa3XcV","employee_name":"Bapi Biswas","total":1530,"_id":{"$oid":"617d07e737eff10017455be1"}},{"service_name":"Threading","service_id":"ud7ij2ML2","quantity":1,"employee_id":"GhAk7n-Kj","employee_name":"Shruti  Agarwal","total":50,"_id":{"$oid":"617d07e737eff10017455be2"}}],"__v":0}
{"_id":{"$oid":"617d0dfd37eff10017455c44"},"bill_id":"CH-uwwQsj9Yg","user_name":"Dunlop  POS 1","user_id":"GXj8dQsbD","customer_name":"pushpita roy","customer_phone":9.83127603E+09,"customer_alternative_phone":null,"customer_address":"","payment_mode":"Card Paytm SD","branch_id":"gW0vfq11U","branch_name":"Dunlop Habibb","total_price":2760,"booking_amount":0,"amount_to_be_paid":2760,"service_amount":null,"date":"30-10-2021","createdOn":{"$date":"2021-10-30T09:18:53Z"},"products":[],"services":[{"service_name":"Threading","service_id":"ud7ij2ML2","quantity":1,"employee_id":"Az8kgfy5i","employee_name":"Gulshan Bano","total":30,"_id":{"$oid":"617d0dfd37eff10017455c45"}},{"service_name":"Threading","service_id":"ud7ij2ML2","quantity":1,"employee_id":"GhAk7n-Kj","employee_name":"Shruti  Agarwal","total":30,"_id":{"$oid":"617d0dfd37eff10017455c46"}},{"service_name":"Haircut","service_id":"_lgiV_EF6","quantity":1,"employee_id":"gRo3RP5_J","employee_name":"Mukti Mohanty","total":500,"_id":{"$oid":"617d0dfd37eff10017455c47"}},{"service_name":"Clean-up Lotus","service_id":"719AEB1pn","quantity":1,"employee_id":"wOOO9yvm9","employee_name":"Vandana Hela","total":600,"_id":{"$oid":"617d0dfd37eff10017455c48"}},{"service_name":"Clean-up Lotus","service_id":"719AEB1pn","quantity":1,"employee_id":"GhAk7n-Kj","employee_name":"Shruti  Agarwal","total":600,"_id":{"$oid":"617d0dfd37eff10017455c49"}},{"service_name":"Waxing Brazilian Full Face","service_id":"-F4k_7r2P","quantity":1,"employee_id":"Az8kgfy5i","employee_name":"Gulshan Bano","total":500,"_id":{"$oid":"617d0dfd37eff10017455c4a"}},{"service_name":"Waxing Brazilian Full Face","service_id":"-F4k_7r2P","quantity":1,"employee_id":"GhAk7n-Kj","employee_name":"Shruti  Agarwal","total":500,"_id":{"$oid":"617d0dfd37eff10017455c4b"}}],"__v":0}
